pma_number,supplement_number,applicant,street_1,street_2,city,state,zip,zip_ext,generic_name,trade_name,product_code,advisory_committee,advisory_committee_description,supplement_type,supplement_reason,expedited_review_flag,date_received,decision_date,docket_number,fed_reg_notice_date,decision_code,ao_statement,device_name,medical_specialty_description,regulation_number,device_class
P140021,S005,ROCHE DIAGNOSTICS OPERATIONS INC,9115 HAGUE ROAD,P.O. BOX 50416,INDIANAPOLIS,IN,46250,0416,"Assay, enzyme linked immunosorbent, hepatitis c virus",ELECSYS  ANTI-HCV II TEST SYSTEM,MZO,MI,Microbiology,Normal 180 Day Track,,N,2016-01-29,2016-07-25,,,APPR,"Approval for the migration of claims from the FDA approved Elecsys Anti-HCV II Immunoassay and Elecsys PreciControl Anti-HCV on the cobas e 601 immunoassay analyzer to the Modular ANALYTICS E170 analyzer.  The device, as modified, will be marketed under the trade name Elecsys Anti-HCV II Immunoassay and Elecsys PreciControl Anti-HCV and is indicated for:   Elecsys Anti-HCV II Immunoassay:  Immunoassay for the in vitro qualitative detection of antibodies to hepatitis C virus (HCV) in human adult and pediatric (ages 18 months through 21 years) serum and plasma (potassium EDTA, lithium heparin, sodium heparin, and sodium citrate).  Assay results, in conjunction with other laboratory results and clinical information, may be used to aid in the presumptive diagnosis of HCV infection in persons with signs and symptoms of hepatitis and in persons at risk for hepatitis C infection.  The test does not determine the state of infection or associated disease. The electrochemiluminescence immunoassay ECLIA is intended for use on the cobas e 601 and MODULAR ANALYTICS E170 immunoassay analyzers. Elecsys PreciControl Anti-HCV:  Elecsys PreciControl Anti-HCV is used for quality control of the Elecsys Anti-HCV and the Elecsys Anti-HCV II immunoassays on the cobas e 601 and the MODULAR ANALYTICS E170 immunoassay analyzers.","Assay, Enzyme Linked Immunosorbent, Hepatitis C Virus",Unknown,,3
P960058,S030,ADVANCED BIONICS,28515 WESTINGHOUSE PLACE,,VALENCIA,CA,91355,,"Implant, cochlear",HIRESOLUTION BIONIC EAR SYSTEM (HIRES 90K),MCM,EN,"Ear, Nose, Throat",Normal 180 Day Track,Change Design/Components/Specifications/Material,N,2003-03-18,2003-07-07,,,APPR,"APPROVAL FOR THE REPACKAGED ICS (IMPLANTABLE COCHLEAR STIMULATOR), REFERRED TO AS HIRES 90K, AND ITS ASSOCIATED SURGICAL TOOLS.  THE DEVICE, AS MODIFIED, WILL BE MARKETED UNDER THE TRADE NAME HIRESOLUTION BIONIC EAR SYSTEM AND IS INDICATED FOR ADULTS AND THE PEDIATRIC POPULATION AGED 12-MONTHS THROUGH 17 YEARS, 11-MONTHS OF AGE.","Implant, Cochlear",Unknown,,3
P030024,S010,ORTHO-CLINICAL DIAGNOSTICS,100 INDIGO CREEK DR.,,ROCHESTER,NY,14626,5101,"Test, hepatitis b (b core, be antigen, be antibody, b core igm)",VITROS IMMUNODIAGNOSTIC PRODUCTS ANTI-HBC REAGENT PACK & CALIBRATOR,LOM,MI,Microbiology,Normal 180 Day Track,Change Design/Components/Specifications/Material,N,2009-02-12,2009-09-11,,,APPR,"APPROVAL FOR THE REVISION OF THE INTENDED USE TO INCLUDE USER OF THE VITROS 5600 INTEGRATED SYSTEM AND VITROS 3600 IMMUNODIAGNOSTIC SYSTEM WITH THE ANTI-HBC ASSAY.  THE DEVICE, AS MODIFIED, WILL BE MARKETED UNDER THE TRADE NAME VITROS IMMUNODIAGNOSTIC PRODUCTS ANTI-HBC REAGENT PACK AND VITROS IMMUNODIAGNOSTIC PRODUCTS ANTI-HBC CALIBRATOR AND IS INDICATED FOR: VITROS IMMUNODIAGNOSTIC PRODUCTS ANTI-HBC REAGENT PACK: FOR THE IN VITRO QUALITATIVE DETECTION OF TOTAL ANTIBODY (LGG AND IGM) TO HEPATITIS B CORE ANTIGEN(TOTAL ANTI-HBC) IN HUMAN ADULT AND PEDIATRIC SERUM AND PLASMA (EDTA AND CITRATE) AND NEONATESERUM USING THE VITROS ECI/ECIQ IMMUNODIAGNOSTIC SYSTEMS, THE VITROS 3600IMMUNODIAGNOSTIC SYSTEM AND THE VITROS 5600 INTEGRATED SYSTEM.ASSAY RESULTS, IN CONJUNCTION WITH OTHER SEROLOGICAL AND CLINICAL INFORMATION, MAY BE USED FOR THELABORATORY DIAGNOSIS OF INDIVIDUALS WITH ACUTE OR CHRONIC HEPATITIS B, OR RECOVERY FROM HEPATITIS B INFECTION. THE PRESENCE OF ANTI-HBC MAY BE USED AS AN AID IN THE DETERMINATION OF EXPOSURE TOHBV INFECTION FOR INDIVIDUALS PRIOR TO HBV VACCINATION.VITROS IMMUNODIAGNOSTIC PRODUCTS ANTI-HBC CALIBRATOR:FOR USE IN THE CALIBRATION OF THE VITROS ECI/ECIQ IMMUNODIAGNOSTIC SYSTEMS, THE VITROS 3600 IMMUNODIAGNOSTIC SYSTEM AND THE VITROS 5600 INTEGRATED SYSTEM FOR THE IN VITROQUALITATIVE DETECTION OF TOTAL ANTIBODY (IGG AND IGM) TO HEPATITIS B VIRUS CORE ANTIGEN (TOTAL ANTI HBC) IN HUMAN ADULT AND PEDIATRIC SERUM AND PLASMA (EDTA AND CITRATE) AND NEONATE SERUMUSING VITROS ANTI-HBC IGM REAGENT PACKS.  THE VITROS ANTI-HBC CALIBRATOR HAS BEEN VALIDATED FOR USE ONLY ON THE VITROS ECI/ECIQIMMUNODIAGNOSTIC SYSTEMS, THE VITROS 3600 IMMUNODIAGNOSTIC SYSTEM AND THE VITROS 5600INTEGRATED SYSTEM WITH THE VITROS IMMUNODIAGNOSTIC PRODUCTS ANTI-HBC REAGENT PACKS.","Test, Hepatitis B (B Core, Be Antigen, Be Antibody, B Core Igm)",Unknown,,3
P960019,,"LASER VISION CENTERS, INC.","540 MARYVILLE CENTRE DR., #200",,ST. LOUIS,MO,63141,,Excimer laser system,LASERVISION/VISX EXCIMER LASER MODEL C,LZS,OP,Ophthalmic,,,N,1996-06-03,1996-11-15,97M-0256,1997-07-23,APWD,"DEVICE INDICATED FOR: 1)PTK IN PATIENTS W/DECREASED BEST CORRECTED VISUAL ACUITY AND/OR WITH DISABLING PAIN THAT ARE THE RESULT OF SUPERFICIAL CORNEAL EPITHELIAL IRREGULARITIES OR STROMAL SCARS IN THE ANTERIOR ONE-THIRD OF THE CORNEA. THE PATIENTS MUST HAVE FAILED W/ALTERNATIVE TREATMENT OPTIONS. FOR SAFETY, THE IMMEDIATE POSTOPERATIVE CORNEAL THICKNESS MUST NOT BE LESS THAN 250 MICRONS. EXAMPLES OF THOSE CONDITIONS THAT WARRANT PTK ARE: A)CORNEAL SCARS & OPACITY (FROM TRAUMA AND INACTIVE INFECTIONS), B)DYSTROPHIES (REIS-BUCKLER'S, GRANULAR AND LATTICE), C)THYGESON'S SUPERFICIAL KERATITIS, D) IRREGULAR CORNEAL SURFACES ASSOCIATED W/FILAMENTARY KERATITIS AND SALZMANN'S NODULAR DEGENERATION, E)RESIDUAL BAND KERATOPATHY AFTER UNSUCCESSFUL EDTA TREATMENT, AND, F)SCARS SUBSEQUENT TO PREVIOUS (NOT CONCURRENT) PTERYGIUM EXCISION.  2)PRK FOR A 6.0 ABLATION ZONE IN PATIENTS WHO ARE MYOPIC AND MEET ALL OF THE FOLLOWING CRITERIA: 1)1.0 TO 6.0 DIOPTERS (D) OF MYOPIA WITH ASTIGMATISM OF 2.0 DIOPTERS; B)REFRACTIVE CHANGE IS WITHIN 0.5D FOR ONE YEAR PRIOR TO THE LASER TREATMENT; AND C)18 YEARS OF AGE OR OLDER.",Excimer Laser System,Unknown,,3
P150021,,Abbott Diabetes Care Inc.,1360 SOUTH LOOP RD.,,ALAMEDA,CA,94502,,"Sensor, glucose, invasive",FREESTYLE LIBRE PRO FLASH GLUCOSE MONITORING SYSTEM,MDS,CH,Clinical Chemistry,,,N,2015-06-19,2016-09-23,16M-2971,2016-09-26,APPR,"The FreeStyle Libre Pro Flash Glucose Monitoring System is a professional continuous glucose monitoring (CGM) device indicated for detecting trends and tracking patterns in persons (age 18 and older) with diabetes. The System is intended for use by health care professionals and requires a prescription. Readings from the FreeStyle Libre Pro Sensor are only made available to patients through consultation with a health care professional. The System does not require user calibration with blood glucose values.The FreeStyle Libre Pro System aids in the detection of glucose level excursions above or below the desired range, facilitating therapy adjustments. Interpretation of the FreeStyle Libre Pro Flash Glucose Monitoring System readings should be based on the trends and patterns analyzed through time using the reports available.","Sensor, Glucose, Invasive",Unknown,,3
P000025,S021,MED-EL CORP.,FURSTENWEG 77a,,INNSBRUCK,,6020,,"Implant, cochlear",SONATATI100 COCHLEAR IMPLANT,MCM,EN,"Ear, Nose, Throat",Normal 180 Day Track,Change Design/Components/Specifications/Material,N,2006-12-15,2007-06-22,,,APPR,"APPROVAL FOR THE SONATATI100 COCHLEAR IMPLANT AND IS INDICATED FOR THE FOLLOWING PATIENT POPULATIONS: ADULTS EIGHTEEN (18) YEARS OF AGE OR OLDER WHO HAVE BILATERAL, SENSORINEURAL HEARING IMPAIRMENT AND OBTAIN LIMITED BENEFIT FROM APPROPRIATELY FITTED BINAURAL HEARING AIDS. THESE INDIVIDUALS TYPICALLY DEMONSTRATE BILATERAL SEVERE TO PROFOUND SENSORINEURAL HEARING LOSS DETERMINED BY A PURE TONE AVERAGE OF 70 DB OR GREATER AT 500 HZ, 1000 HZ, AND 2000 HZ. LIMITED BENEFIT FROM AMPLIFICATION IS DEFINED BY TEST SCORES OF 40% CORRECT OR LESS IN BEST-AIDED LISTENING CONDITION ON CD RECORDED TESTS OF OPEN-SET SENTENCE RECOGNITION (HEARING IN NOISE TEST [HINT] SENTENCES).  CHILDREN AGED TWELVE (12) MONTHS TO SEVENTEEN (17) YEARS ELEVEN (11) MONTHS MUST DEMONSTRATE A PROFOUND, BILATERAL SENSORINEURAL HEARING LOSS WITH THRESHOLDS OF 90 DB OR GREATER AT 1000 HZ. IN YOUNGER CHILDREN, LITTLE OR NO BENEFIT IS DEFINED BY LACK OF PROGRESS IN THE DEVELOPMENT OF SIMPLE AUDITORY SKILLS IN CONJUNCTION WITH APPROPRIATE AMPLIFICATION AND PARTICIPATION IN INTENSIVE AURAL HABILITATION OVER A THREE (3) TO SIX (6) MONTH PERIOD. IN OLDER CHILDREN, LACK OF AID BENEFIT IS DEFINED AS < 20% CORRECT ON THE MULTI-SYLLABIC LEXICAL NEIGHBOURHOOD TEST (MLNT) OR LEXICAL NEIGHBOURHOOD TEST (LNT), DEPENDING UPON THE CHILD'S COGNITIVE ABILITY AND LINGUISTIC SKILLS. A THREE (3) TO SIX (6) MONTH HEARING AID TRIAL IS REQUIRED FOR CHILDREN WITHOUT PREVIOUS EXPERIENCE WITH HEARING AIDS.  RADIOLOGICAL EVIDENCE OF COCHLEAR OSSIFICATION MAY JUSTIFY A SHORTER TRIAL WITH AMPLIFICATION.","Implant, Cochlear",Unknown,,3
P970043,S020,ALCON LABORATORIES,6201 S FREEWAY,,FT WORTH,TX,76134,,Excimer laser system,LADARVISION 4000 EXCIMER LASER SYSTEM,LZS,OP,Ophthalmic,Panel Track,Labeling Change - Indications/instructions/shelf life/tradename,N,2005-05-27,2006-05-01,06M-0323,2006-08-17,APPR,"APPROVAL FOR THE LADARVISION 4000 EXCIMER LASER SYSTEM AND THE LADAR 6000 EXCIMER LASER SYSTEM.  THESE DEVICES USE A 6.5 MM OPTICAL ZONE AND A 9.0 TREATMENT ZONE AND ARE INDICATED FOR WAVE-FRONT GUIDED CUSTOMCORNEA LASER ASSISTED IN-SITU KERATOMILEUSIS (LASIK): 1) FOR THE REDUCTION OR ELIMINATION OF HYPEROPIA AND HYPEROPIC ASTIGMATISM OF +0.75 D TO LESS THAT +5.00 D OF SPHERE WITH UP TO -3.00 D OF CYLINDER (WHICH HAS A MAGNITUDE LESS THAN OR EQUAL TO THE SPHERE IN MINUS CYLINDER CONVENTION) AND UP TO +5.00 CYCLOPLEGIC SPHERICAL EQUIVALENT AT THE SPECTACLE PLANE; 2) IN PATIENTS 21 YEARS OF AGE OR OLDER; AND 3) IN PATIENTS WITH DOCUMENTED STABILITY OF REFRACTION FOR THE PRIOR 12 MONTHS, AS DEMONSTRATED BY A CHANGE IN SPHERE AND CYLINDER OF LESS THAN OR EQUAL TO 0.50 D.",Excimer Laser System,Unknown,,3
P090022,S022,"LENSTEC, INC.",1765 COMMERCE AVE N,,ST. PETERSBURG,FL,33716,,intraocular lens,SOFTEE HD POSTERIOR CHAMBER INTRAOCULAR LENS (PCIOL),HQL,OP,Ophthalmic,Real-Time Process,Change Design/Components/Specifications/Material,N,2014-05-12,2014-06-16,,,APPR,"APPROVAL TO REDUCE THE SIZE OF THE SECONDARY PACKAGING WHICH HOUSES THE POUCHED INTRAOCULAR LENSES, LABEL AND DIRECTIONS FOR USE (DFU). THE DEVICE, AS MODIFIED, WILL BE MARKETED UNDER THE TRADE NAME SOFTEC HD, SOFTEC I, AND SOFTEC HDO AND IS INDICATED FOR THE REPLACEMENT OF THE HUMAN CRYSTALLINE LENS FOLLOWING PHACOEMULSIFICATON CATARACT REMOVAL INADULTS OVER THE AGE OF 21.",Intraocular Lens,Ophthalmic,886.3600,3
P950021,S002,SIEMENS HEALTHCARE DIAGNOSTICS,333 CONEY STREET,,WALPOLE,MA,02032,1516,PROSTATE-SPECIFIC ANTIGEN (PSA) FOR MANAGEMENT OF PROSTATE CANCERS,ACS:180(TM)/ADVIA CENTAUR(TM) PSA ASSAY,LTJ,IM,Immunology,Panel Track,Labeling Change - Indications/instructions/shelf life/tradename,N,2000-07-31,2000-12-22,01M-0038,2001-02-07,APPR,"APPROVAL FOR THE ACS:180 AND ADVIA CENTAUR IMMUNOASSAY ANALYZERS.  THE DEVICE, AS MODIFIED, WILL BE MARKETED UNDER THE TRADE NAMES ACS:180 PSA IMMUNOASSAY AND ADVIA CENTAUR PSA IMMUNOASSAY AND IS INDICATED FOR THE FOLLOWING:  THE BAYER ACS:180(TM) AND ADVIA CENTAUR(TM) PSA ASSAYS ARE IN VITRO DEVICES INTENDED FORO THE QUANTITATIVE MEASUREMENT OF PROSTATE-SPECIFIC ANTIGEN (PSA) IN HUMAN SERUM.  THESE DEVICES ARE INDICATED FOR THE MEASUREMENT OF SERUM PSA IN CONJUNCTION WITH DIGITAL RECTAL EXAM (DRE) AS AN AID IN THE DETECTION PROSTATE CANCER IN MEN AGED 50 YEARS AND OLDER.  PROSTATE BIOPSY IS REQUIRED FOR THE DIAGNOSIS OF PROSTATE CANCER.  THESE DEVICES ARE FURTHER INDICATED AS AN AID IN THE MANAGEMENT (MONITORING) OF PROSTATE CANCER PATIENTS.",Prostate-Specific Antigen (Psa) For Management Of Prostate Cancers,Immunology,866.6010,2
P040024,S051,Q-Med AB,SEMINARIEGATAN 21,,UPPSALA,,SE-75,752-,"Implant, dermal, for aesthetic use",RESTYLANE INJECTABLE GEL,LMH,SU,"General, Plastic Surgery",Panel Track,Labeling Change - Indications/instructions/shelf life/tradename,N,2010-12-01,2011-10-11,11M-0735,2011-10-20,APPR,"APPROVAL FOR RESTYLANE INJECTABLE GEL.  THIS DEVICE IS INDICATED FOR: 1)  MID-TO-DEEP DERMAL IMPLANTATION FOR THE CORRECTION OF MODERATE TO SEVERE FACIAL WRINKLES AND FOLDS, SUCH AS NASOLABIAL FOLDS; AND 2) SUBMUCOSAL IMPLANTATION FOR LIP AUGMENTATION IN PATIENTS OVER THE AGE OF 21.","Implant, Dermal, For Aesthetic Use",Unknown,,3
P030008,S006,"Alcon Laboratories, Inc.",6201 South Freeway,,Fort Worth,TX,76134,2099,Excimer laser system,WAVELIGHT EX500 LASER SYSTEM,LZS,OP,Ophthalmic,Normal 180 Day Track,Change Design/Components/Specifications/Material,N,2011-04-04,2011-11-23,,,APPR,"APPROVAL FOR INCREASED PULSE FREQUENCY FROM 400 TO 500 HZ, A NEW LASER HEAD, A NEW HOUSING WITH GREATER INTEGRATION OF ACCESSORIES, MODIFIED LASER PULSE TEMPORAL PARAMETERS, NEW EYETRACKER, NEW SCANNER, REMODELED USER INTERFACE, ADDITION OF NETWORKING CAPABILITY, ANDMODIFIED SOFTWARE. THE DEVICE, AS MODIFIED, WILL BE MARKETED UNDER THE TRADE NAME WAVELIGHT EX500 LASER SYSTEM AND IS INDICATED FOR LASER ASSISTED IN SITU KERATOMILEUSIS (LASIK) FOR:1) THE REDUCTION OR ELIMINATION OF MYOPIA OF UP TO -12.0 DIOPTERS (D) OF SPHERE AND UP TO - 6.0 D OF ASTIGMATISM AT THE SPECTACLE PLANE IN PATIENTS WHO ARE 18 YEARS OF AGE OR OLDER WITH DOCUMENTATION OF A STABLE MANIFEST REFRACTION DEFINED AS <= 0.50 D OF PREOPERATIVESPHERICAL EQUIVALENT SHIFT OVER ONE YEAR PRIOR TO SURGERY;2) THE REDUCTION OR ELIMINATION OF HYPEROPIC REFRACTIVE ERRORS UP TO +6.0 D OF SPHERE WITH AND WITHOUT ASTIGMATIC REFRACTIVE ERRORS UP TO 5.0 D AT THE SPECTACLE PLANE, WITH A MAXIMUM MANIFEST REFRACTION SPHERICAL EQUIVALENT (MRSE) OF +6.0 D IN PATIENTS WHO ARE 18 YEARS OF AGE OR OLDER WITH DOCUMENTATION OF STABLE MANIFEST REFRACTION DEFINED AS<= 0.50 D OF PREOPERATIVE SPHERICAL EQUIVALENT SHIFT OVER ONE YEAR PRIOR TO SURGERY, EXCLUSIVE OF CHANGES DUE TO UNMASKING LATENT HYPEROPIA;3) THE REDUCTION OR ELIMINATION OF NATURALLY OCCURRING MIXED ASTIGMATISM OF UP TO 6.00 D AT THE SPECTACLE PLANE IN PATIENTS WHO ARE 21 YEARS OF AGE OR OLDER WITH DOCUMENTATION OF A STABLE MANIFEST REFRACTION DEFINED AS  <= 0.50 D PREOPERATIVE SPHERICAL EQUIVALENT SHIFT OVER ONE YEAR PRIOR TO SURGERY; AND 4) THE WAVEFRONT-GUIDED (WFG) REDUCTION OR ELIMINATION OF UP TO -7.00 D OF SPHERICAL EQUIVALENT MYOPIA OR MYOPIA WITH ASTIGMATISM, WITH UP TO -7.00 D OF SPHERICAL COMPONENT AND UP TO 3.00 D OF ASTIGMATIC COMPONENT AT THE SPECTACLE PLANE IN PATIENTS WHO ARE 18 YEARS OF AGE OR OLDER WITH DOCUMENTATION OF A STABLE MANIFEST REFRACTION DEFINED AS <= 0.50 D OF PREOPERATIVE SPHERICAL SHIFT OVER ONE YEAR PRIOR TO SURGERY.",Excimer Laser System,Unknown,,3
P080028,,STORZ MEDICAL AG,LOHSTAMPFESTRASSE 8,,TAGERWILEN,,CH-82,8274,"Generator, shock-wave, for pain relief",STORZ MEDICAL DUOLITH SD1 SHOCK WAVE THERAPY,NBN,SU,"General, Plastic Surgery",,,N,2008-11-26,2016-01-08,16M-0122,2016-01-11,APPR,APPROVAL FOR THE STORZ MEDICAL DUOLITH SD1 SHOCK WAVE THERAPY. THIS DEVICE IS INDICATED FOR EXTRACORPOREAL SHOCK WAVE TREATMENT OF HEEL PAIN DUE TO CHRONIC PROXIMAL PLANTAR FASCIITIS FOR PATIENTS OF AGE GREATER THAN 18 YEARS WITH A HISTORY OF FAILED ALTERNATIVE CONSERVATIVE THERAPIES FOR AT LEAST SIX MONTHS. CHRONIC PROXIMAL PLANTAR FASCIITIS IS DEFINED AS TRACTION DEGENERATION OF THE PLANTAR FASCIAL BAND AT THE ORIGIN ON THE MEDIAL CALCANEAL TUBEROSITY THAT HAS PERSISTED FOR SIX MONTHS OR MORE.,"Generator, Shock-Wave, For Pain Relief",Unknown,,3
P980022,S011,MEDTRONIC MINIMED,18000 DEVONSHIRE ST,,NORTHRIDGE,CA,91325,,"Sensor, glucose, invasive",GUARDIAN RT CONTINUOUS GLUCOSE MONITORING SYSTEM,MDS,CH,Clinical Chemistry,Panel Track,,Y,2004-08-20,2005-07-18,05M-0454,2005-11-15,APPR,"APPROVAL FOR THE GUARDIAN RT.  THE DEVICE IS INDICATED FOR CONTINUOUS OR PERIODIC MONITORING OF GLUCOSE LEVELS IN THE FLUID UNDER THE SKIN IN ADULTS (AGES 18 AND OLDER) WITH DIABETES MELLITUS FOR THE PURPOSE OF IMPROVING DIABETES MANAGEMENT.  IT ALERTS IF A GLUCOSE LEVEL FALLS BELOW OR RISES ABOVE PRESET VALUES.  VALUES ARE NOT INTENDED TO BE USED DIRECTLY FOR MAKING THERAPY ADJUSTMENTS, BUT RATHER TO PROVIDE AN INDICATION OF WHEN A FINGER STICK MAY BE REQUIRED.  ALL THERAPY ADJUSTMENTS WOULD BE BASED ON MEASUREMENTS OBTAINED USING A HOME GLUCOSE MONITOR AND NOT ON GUARDIAN VALUES.  GUARDIAN RT PROVIDES REAL-TIME GLUCOSE VALUES THAT ALLOW USERS TO TRACK PATTERNS IN GLUCOSE CONCENTRATIONS AND TO POSSIBLY IDENTIFY EPISODES OF LOW AND HIGH BLOOD GLUCOSE EPISODES.  IT ALSO STORES THE DATA SO THAT IT CAN BE ANALYZED TO TRACK PATTERNS.  GLUCOSE DATA CAN BE FURTHER DOWNLOADED TO PC SOFTWARE FOR ANALYSIS OF HISTORICAL GLUCOSE VALUES.","Sensor, Glucose, Invasive",Unknown,,3
P970003,S207,"LivaNova USA, Inc.",100 Cyberonics Blvd.,,Houston,TX,77058,,"STIMULATOR, AUTONOMIC NERVE, IMPLANTED FOR EPILEPSY",VNS THERAPY SYSTEM,LYJ,NE,Neurology,Panel Track,Labeling Change - Indications/instructions/shelf life/tradename,N,2016-11-17,2017-06-23,17M-3951,2017-07-24,APPR,Approval for the VNS Therapy System.  The device is indicated for use as an adjunctive therapy in reducing the frequency of seizures in patients 4 years of age and older with partial onset seizures that are refractory to antiepileptic medications.,"Stimulator, Autonomic Nerve, Implanted For Epilepsy",Unknown,,3
P990078,,"SUNRISE TECHNOLOGIES, INC.",3400 W. WARREN AVE.,,FREMONT,CA,94538,,"Laser, neodymium:Yag, ophthalmic for uses other than posterior capsulotomy & cutting pupillary",HYPERION LTK SYSTEM,LOI,OP,Ophthalmic,,,N,1999-11-03,2000-06-30,00M-1386,2000-07-11,APPR,"APPROVAL FOR THE SUNRISE HYPERION(TM) LTK SYSTEM.  THE DEVICE IS INDICATED FOR TEMPORARY REDUCTION OF HYPEROPIA IN PATIENTS WITH +0.75 TO +2.5 DIOPTERS OF MANIFEST REFRACTION SPHERICLA EQUIVALENT (MRSE) AT THE SPECTACLE PLANE (WITH CYLINDER LESS THAN OR EQUAL TO +-0.75 DIOPTERS) WHO ARE 40 YEARS OF AGE OR OLDER WITH DOCUMENTED STABILITY OF REFRACTION FOR THE PRIOR 6 MONTHS, AS DEMONSTRATED BY A CHANGE OF LESS THAN OR EQUAL TO 0.50D IN SPHERICAL, AND CYLINDRICAL COMPONENTS OF THE MANIFEST REFRACS","Laser, Neodymium:Yag, Ophthalmic For Uses Other Than Posterior Capsulotomy & Cutting Pupillary",Unknown,,3
P990025,S011,"BIOSENSE WEBSTER, INC.",31 Technology Drive,Suite 200,Irvine,CA,92618,,Cardiac ablation percutaneous catheter,QWIKSTAR NAVIGATION/ABLATION CATHETER,LPB,CV,Cardiovascular,Real-Time Process,Labeling Change - Indications/instructions/shelf life/tradename,N,2006-01-18,2006-03-28,,,APPR,"APPROVAL FOR A MINOR LABELING REVISION FOR THE 4 MM QWIKSTAR DIAGNOSTIC/ABLATION CATHETER TO INCLUDE THE NOGA XP NAVIGATION SYSTEM AS AN OPTIONAL MAPPING SYSTEM FOR THE QWIKSTAR CATHETER.  THE DEVICE, AS MODIFIED, WILL BE MARKETED UNDER THE SAME TRADE NAME AND IS INDICATED FOR CATHETER-BASED ATRIAL AND VENTRICULAR ELECTROPHYSIOLOGICAL MAPPING AND FOR USE WITH COMPATIBLE RADIO-FREQUENCY GENERATORS IN ADULTS AND CHILDREN FOUR YEARS OF AGE OR OLDER IN CREATING ENDOCARDIAL LESIONS DURING CARDIAC ABLATION PROCEDURES TO TREAT ARRHYTHMIAS.  WHEN USED IN THE CARTO XP EP OR NOGA XP NAVIGATION SYSTEMS, THE QWIKSTAR DIAGNOSTIC/ABLATION CATHETER PROVIDES LOCATION INFORMATION AND APPROXIMATE CATHETER TIP CURVATURE.",Cardiac Ablation Percutaneous Catheter,Unknown,,3
P040039,,"ORTHOMETRIX, INC.",5621 STRAND BLVD,SUITE 111,NAPLES,FL,34110,,"Generator, shock-wave, for pain relief",ORBASONE PAIN RELIEF SYSTEM,NBN,OR,Orthopedic,,,N,2004-09-14,2005-08-10,05M-0339,2005-08-25,APWD,APPROVAL FOR THE ORBASONE PAIN RELIEF SYSTEM.  THE DEVICE IS INDICATED FOR EXTRACORPOREAL SHOCK WAVE THERAPY FOR THE TREATMENT OF CHRONIC PROXIMAL PLANTAR FASCIITIS IN PATIENTS 18 YEARS OF AGE OR OLDER THAT HAVE FAILED TO RESPOND TO CONSERVATIVE THERAPY.  CHRONIC PROXIMAL PLANTAR FASCIITIS IS DEFINED AS HEEL PAIN IN THE AREA OF THE INSERTION OF THE PLANTAR FASCIA ON THE MEDIAL CALCANEAL TUBEROSITY THAT HAS PERSISTED FOR SIX MONTHS OR MORE.,"Generator, Shock-Wave, For Pain Relief",Unknown,,3
P990055,S007,SIEMENS HEALTHCARE DIAGNOSTICS,333 CONEY STREET,,WALPOLE,MA,02032,1516,"ANTIGEN(COMPLEXED),PROSTATE SPECIFIC,(CPSA)",BAYER ADVIA IMS CPSA ASSAY,NAF,IM,Immunology,Real-Time Process,Labeling Change - Indications/instructions/shelf life/tradename,N,2003-07-16,2003-09-02,,,APPR,"APPROVAL FOR THE ADDITION OF THE CPSA ASSAY TO THE BAYER ADVIA IMS SYSTEM.  THE DEVICE, AS MODIFIED, WILL BE MARKETED UNDER THE TRADE NAME BAYER ADVIA IMS CPSA ASSAY AND IS INDICATED AS AN AID IN THE DETECTION OF PROSTATE CANCER IN MEN AGED 50 YEARS OR OLDER IN CONJUNCTION WITH DIGITAL RECTAL EXAM.","Antigen(Complexed),Prostate Specific,(Cpsa)",Unknown,,3
P140021,,ROCHE DIAGNOSTICS OPERATIONS INC,9115 HAGUE ROAD,P.O. BOX 50416,INDIANAPOLIS,IN,46250,0416,"Assay, enzyme linked immunosorbent, hepatitis c virus","ELECSYS ANTI-HCV II IMMUNOASSAY, ELECSYS PRECICONTROL ANTI-HCV",MZO,MI,Microbiology,,,N,2014-10-01,2015-06-11,15M-2217,2015-07-10,APPR,"APPROVAL FOR THE ELECSYS ANTI-HCV II IMMUNOASSAY AND ELECSYS PRECICONTROL ANTI-HCV. THIS DEVICE IS INDICATED FOR: ELECSYS ANTI-HCV II IMMUNOASSAYIMMUNOASSAY FOR THE IN VITRO QUALITATIVE DETECTION OF ANTIBODIES TO HEPATITIS C VIRUS (HCV) IN HUMAN ADULT AND PEDIATRIC (AGES 18 MONTHS THROUGH 21 YEARS) SERUM AND PLASMA (POTASSIUM EDTA, LITHIUM HEPARIN, SODIUM HEPARIN, AND SODIUM CITRATE). ASSAY RESULTS, IN CONJUNCTION WITH OTHER LABORATORY RESULTS AND CLINICAL INFORMATION, MAY BE USED TO AID IN THE PRESUMPTIVE DIAGNOSIS OF HCV INFECTION IN PERSONS WITH SIGNS AND SYMPTOMS OF HEPATITIS AND IN PERSONS AT RISK FOR HEPATITIS C INFECTION. THE TEST DOES NOT DETERMINE THE STATE OF INFECTION OR ASSOCIATED DISEASE.THE ELECTROLUMINESCENCE IMMUNOASSAY ECLIA IS INTENDED FOR USE ON THE ROCHE COBAS E 601 IMMUNOASSAY ANALYZER.ELECSYS PRECICONTROL ANTI-HCV ELECSYS PRECICONTROL ANTI-HCV IS USED FOR QUALITY CONTROL OF THE ELECSYS ANTI-HCV IMMUNOASSAY ON THE COBAS E 601 AND COBAS E 602 IMMUNOASSAY ANALYZERS AND THE ELECSYS ANTI-HCV II IMMUNOASSAY ON THE COBAS E 601 IMMUNOASSAY ANALYZER.","Assay, Enzyme Linked Immunosorbent, Hepatitis C Virus",Unknown,,3
P990056,S001,ROCHE DIAGNOSTICS CORP.,9115 HAGUE RD.,,INDIANAPOLIS,IN,46250,,PROSTATE-SPECIFIC ANTIGEN (PSA) FOR MANAGEMENT OF PROSTATE CANCERS,ELECSYS TOTAL PSA IMMUNOASSAY/TOTAL PSA CALSET,LTJ,IM,Immunology,Normal 180 Day Track,Change Design/Components/Specifications/Material,N,2001-10-09,2002-02-08,,,APPR,"APPROVAL FOR THE ADDITION OF THE ASSAY TO THE MODULAR ANALYTICS E170 (ELECSYS MODULE) IMMUNOASSAY ANALYZER.  THE DEVICE, AS MODIFIED, WILL BE MARKETED UNDER THE TRADE NAME ELECSYS TOTAL PSA IMMUNOASSAY AND ELECSYS TOTAL PSA CALSET AND ARE INDICATED AS FOLLOWS:  THE ELECSYS TOTAL PSA IMMUNOASSAY, A QUANTITATIVE IN VITRO DIAGNOSTIC TEST FOR TOTAL PROSTATE-SPECIFIC ANTIGEN (TPSA) IN HUMAN SERUM AND PLASMA, IS INDICATED FOR THE MEASUREMENT OF TOTAL PSA IN CONJUNCTION WITH DIGITAL RECTAL EXAMINATION (DRE) AS AN AID IN THE DETECTION OF PROSTATE CANCER IN MEN AGED 50 YEARS OR OLDER.  PROSTATE BIOPSY IS REQUIRED FOR DIAGNOSIS OF PROSTATE CANCER.  THE TEST IS FURTHER INDICATED FOR SERIAL MEASUREMENT OF TPSA TO AID IN THE MANAGEMENT OF CANCER PATIENTS.  THE ELECTROCHEMILUMIN-ESCENCE IMMUNOASSAY ""ECLIA"" IS INTENDED FOR USE ON THE ROCHE ELECSYS 1010/2010 AND MODULAR ANALYTICS E170 (ELECSYS MODULE) IMMUNOASSAY ANALYZERS.",Prostate-Specific Antigen (Psa) For Management Of Prostate Cancers,Immunology,866.6010,2
P150019,,MEDTRONIC MINIMED,18000 DEVONSHIRE ST,,NORTHRIDGE,CA,91325,,"Sensor, glucose, invasive",PARADIGM REAL-TIME REVEL SYSTEM,MDS,CH,Clinical Chemistry,,,N,2015-06-10,2015-12-07,15M-4728,2015-12-22,APPR,"APPROVAL FOR THE PARADIGM REAL-TIME REVEL SYSTEM. THIS DEVICE IS INDICATED FOR:PARADIGM REAL-TIME REVEL INSULIN PUMP.  THE PARADIGM REAL-TIME REVEL INSULIN PUMPS (MMT-523/MMT-723) ARE INDICATED FOR THE CONTINUOUS DELIVERY OF INSULIN, AT SET AND VARIABLE RATES, FOR THE MANAGEMENT OF DIABETES MELLITUS IN PERSONS REQUIRING INSULIN.  THE PARADIGM REAL-TIME REVEL SYSTEM CONSISTS OF THE PARADIGM MMT-523/MMT-723 INSULIN PUMPS, THE ENLITE GLUCOSE SENSOR (MMT-7008), AND THE MINILINK TRANSMITTER (MMT-7703). USE OF THE PARADIGM MMT-523/MMT-723 INSULIN PUMPS WITH THE OPTIONAL SENSOR AND TRANSMITTER COMPONENTS IS INDICATED FOR CONTINUOUS OR PERIODIC MONITORING OF GLUCOSE LEVELS IN THE FLUID UNDER THE SKIN, AND POSSIBLE LOW AND HIGH BLOOD GLUCOSE EPISODES IN ADULTS (AGES 18 AND OLDER).  ENLITE SENSOR:  THE ENLITE SENSOR (MMT-7008) IS INTENDED FOR USE WITH THE PARADIGM REAL-TIME REVEL INSULIN PUMP SYSTEMS (MMT-523/MMT-723) TO CONTINUOUSLY MONITOR GLUCOSE LEVELS IN PERSONS WITH DIABETES.GLUCOSE VALUES PROVIDED BY THE PARADIGM REAL-TIME REVEL SYSTEM ARE NOT INTENDED TO BE USED DIRECTLY FOR MAKING THERAPY ADJUSTMENTS, BUT RATHER TO PROVIDE AN INDICATION OF WHEN A FINGERSTICK MAY BE REQUIRED. ALL THERAPY ADJUSTMENTS SHOULD BE BASED ON MEASUREMENTS OBTAINED USING A HOME GLUCOSE MONITOR AND NOT ON THE SENSOR GLUCOSE READINGS PROVIDED BY THE PARADIGM REAL-TIME REVEL SYSTEM.","Sensor, Glucose, Invasive",Unknown,,3
P980040,,"Johnson & Johnson Surgical Vision, Inc.",1700 E. St. Andrew Place,,Santa Ana,CA,92705,,intraocular lens,SENSAR SOFT ACRYLIC UV-LIGHT ABSORBING POSTERIOR CHAMBER INTRAOCULAR LENS,HQL,OP,Ophthalmic,,,N,1998-10-01,2000-02-03,00M=0445,2000-02-16,APPR,"Approval for the AMO® SENSAR Soft Acrylic, UV Light-Absorbing, Posterior Chamber Intraocular Lens (IOL), Model AR40.  This device is indicated for the visual correction of aphakia in persons 60 years of age or older in whom a cataractous lens has been removed by extracapsular cataract extraction.  The lens is intended to be placed in the capsular bag.",Intraocular Lens,Ophthalmic,886.3600,3
