pma_number,supplement_number,applicant,street_1,street_2,city,state,zip,zip_ext,generic_name,trade_name,product_code,advisory_committee,advisory_committee_description,supplement_type,supplement_reason,expedited_review_flag,date_received,decision_date,docket_number,fed_reg_notice_date,decision_code,ao_statement,device_name,medical_specialty_description,regulation_number,device_class
P120005,,"DEXCOM, INC.",6340 SEQUENCE DR,,SAN DIEGO,CA,92121,,"Sensor, glucose, invasive",DEXCOM G4 PLATINUM CONTIUOUS GLUCOSE MONITORING SYSTEM,MDS,CH,Clinical Chemistry,,,N,2012-04-09,2012-10-05,12M-1049,2012-10-12,APPR,"APPROVAL FOR THE DEXCOM G4 PLATINUM CONTINUOUS GLUCOSE MONITORING SYSTEM. THIS DEVICE IS INDICATED FOR:THE DEXCOM G4 PLATINUM CONTINUOUS GLUCOSE MONITORING SYSTEM IS A GLUCOSE MONITORING DEVICE INDICATED FOR DETECTING TRENDS AND TRACKING PATTERNS IN PERSONS (AGE 18 AND OLDER) WITH DIABETES. THE SYSTEM IS INTENDED FOR SINGLE PATIENT USE AND REQUIRES A PRESCRIPTION.THE DEXCOM G4 PLATINUM SYSTEM IS INDICATED FOR USE AS AN ADJUNCTIVE DEVICE TO COMPLEMENT, NOT REPLACE, INFORMATION OBTAINED FROM STANDARD HOME GLUCOSE MONITORING DEVICES.  THE DEXCOM G4 PLATINUM SYSTEM AIDS IN THE DETECTION OF EPISODES OFHYPERGLYCEMIA AND HYPOGLYCEMIA, FACILITATING BOTH ACUTE AND LONG-TERM THERAPY ADJUSTMENTS, WHICH MAY MINIMIZE THESE EXCURSIONS. INTERPRETATION OF THE DEXCOM G4 PLATINUM SYSTEM RESULTS SHOULD BE BASED ON THE TRENDS AND PATTERNS SEEN WITH SEVERAL SEQUENTIAL READINGS OVER TIME.","Sensor, Glucose, Invasive",Unknown,,3
P950005,S010,"Biosense Webster, Inc",31 Technology Drive,Suite 200,Irvine,CA,92618,,"CATHETER, ELECTRODE RECORDING, OR PROBE, ELECTRODE RECORDING",CELSIUS DIAGNOSTIC/ABLATION DEFLECTABLE TIP CATHETER,DRF,CV,Cardiovascular,Normal 180 Day Track,Labeling Change - Indications/instructions/shelf life/tradename,N,2000-12-08,2001-10-05,,,APPR,"APPROVAL FOR EXPANDING THE INDICATIONS FOR USE.  THE DEVICE, AS MODIFIED, WILL BE MARKETED UNDER THE TRADE NAME CELSIUS DIAGNOSTIC/ABLATION DEFLECTABLE TIP CATHETER AND IS INDICATED AS FOLLOWS:  THE BIOSENSE WEBSTER CELSIUS DIAGNOSTIC/ABLATION DEFLECTABLE TIP CATHETER AND RELATED ACCESSORIES ARE INDICATED FOR CATHETER-BASED ATRIAL AND VENTRICULAR ELECTROPHYSIOLOGICAL MAPPING AND FOR USE WITH COMPATIBLE RADIOFREQUENCY GENERATORS IN ADULTS AND CHILDREN 4 YEARS OF AGE AND OLDER IN CREATING ENDOCARDIAL LESIONS DURING CARDIAC ABLATION PROCEDURES TO TREAT ARRHYTHMIAS.","Catheter, Electrode Recording, Or Probe, Electrode Recording",Cardiovascular,870.1220,2
P990010,,"AMO Manufacturing USA, LLC",510 Cottonwood Drive,,Milpitas,CA,95035,,Excimer laser system,VISX EXCIMER LASER SYSTEM MODEL C STAR,LZS,OP,Ophthalmic,,,N,1999-02-23,1999-11-19,00M-1447,2000-08-18,APPR,"Approval for the VISX Excimer Laser System Model C (STAR S2) which included the right to reference information contained in P930016 from VISX, Inc., of Santa Clara, CA.  This device is indicated to perfrom LASIK:  1) in patients 18 years of age or older in treatments for the reduction or elimination of myopia (nearsightedness) from 0 to -14.0 diopters (D) with or without -0.5 D to -5.0 D of astigmatism; and 2) in patients with documented evidence of a change in manifest refraction of less than or equalto 0.5 D (in both cylinder and sphere components) per year for at least one year prior to the date of pre-operative examination.",Excimer Laser System,Unknown,,3
P120005,S036,"DEXCOM, INC.",6340 SEQUENCE DR,,SAN DIEGO,CA,92121,,"Sensor, glucose, invasive",DEXCOM G4TM PLATINUM CONTINUOUS GLUCOSE MONITORING SYSTEM,MDS,CH,Clinical Chemistry,Real-Time Process,Change Design/Components/Specifications/Material,N,2015-05-14,2015-07-02,,,APPR,"APPROVAL FOR SOFTWARE MODIFICATIONS TO THE EXISTING FIRMWARE UPDATE TOOL TO ALLOW THE TOOL TO BE RUN ON MAC OS X OPERATING SYSTEMS, TO IMPROVE THE RUNTIME AND SIMPLIFY INSTALLATION STEPS ON CURRENTLY SUPPORTED WINDOWS PLATFORMS, TO ADD NOTIFICATIONS WHICHALERT USERS COMPATIBILITY ISSUES WITH USB 3.0 PORTS, AND TO IMPROVE COMPATIBILITY WITH FUTURE DEXCOM PRODUCTS. THE DEVICE, AS MODIFIED, WILL BE MARKETED UNDER THE TRADE NAME DEXCOM G4PLATINUM CONTINUOUS GLUCOSE MONITORING SYSTEM AND IS INDICATED FOR DETECTING TRENDS AND TRACKING PATTERNS IN PERSONS (AGE 18 AND OLDER) WITH DIABETES. THE SYSTEM IS INTENDED FOR SINGLE PATIENT USE AND REQUIRES A PRESCRIPTION. THE DEXCOM G4 PLATINUM SYSTEM IS INDICATED FOR USEAS AN ADJUNCTIVE DEVICE TO COMPLEMENT, NOT REPLACE, INFORMATION OBTAINED FROM STANDARD HOME GLUCOSE MONITORING DEVICES. THE DEXCOM G4 PLATINUM SYSTEM AIDS IN THE DETECTION OF EPISODES OF HYPERGLYCEMIA AND HYPOGLYCEMIA, FACILITATING BOTH ACUTE AND LONG-TERM THERAPY ADJUSTMENTS, WHICH MAY MINIMIZE THESE EXCURSIONS. INTERPRETATION OF THE DEXCOM G4PLATINUM SYSTEM RESULTS SHOULD BE BASED ON THE TRENDS AND PATTERNS SEEN WITH SEVERAL SEQUENTIAL READINGS OVER TIME.","Sensor, Glucose, Invasive",Unknown,,3
P040036,S037,"BIOSENSE WEBSTER, INC.",31 Technology Drive,Suite 200,Irvine,CA,92618,,Cardiac ablation percutaneous catheter,"THERMOCOOL SMARTTOUCH BI-DIRECTIONAL NAVIGATION CATHETER,THERMOCOOL SMARTTOUCH UNI-DIRECTIONAL NAVIGATION CATHETER,THERM",LPB,CV,Cardiovascular,Normal 180 Day Track,,N,2013-06-17,2014-02-11,,,APPR,"APPROVAL FOR THE ADDITION OF FORCE SENSING TECHNOLOGY TO THE CATHETER TIP.THE DEVICE, AS MODIFIED, WILL BE MARKETED UNDER THE TRADE NAME THERMOCOOL SMARTTOUCHCATHETER AND IS INDICATED FOR:THE BIOSENSE WEBSTER THERMOCOOL SMARTTOUCH NAVIGATION CATHETER AND RELATED ACCESSORY DEVICES ARE INDICATED FOR CATHETER-BASED CARDIAC ELECTROPHYSIOLOGICAL MAPPING (STIMULATING AND RECORDING) AND, WHEN USED WITH A COMPATIBLE RF GENERATOR, FOR THE TREATMENT OF:1) TYPE I ATRIAL FLUTTER IN PATIENTS AGE 18 OR OLDER;2) RECURRENT DRUG/DEVICE REFRACTORY SUSTAINED MONOMORPHIC VENTRICULAR TACHYCARDIA(VT) DUE TO PRIOR MYOCARDIAL INFARCTION (MI) IN ADULTS; AND3) DRUG REFRACTORY RECURRENT SYMPTOMATIC PAROXYSMAL ATRIAL FIBRILLATION, WHEN USED WITH COMPATIBLE THREE-DIMENSIONAL ELECTROANATOMIC MAPPING SYSTEMS.THE THERMOCOOL SMARTTOUCH NAVIGATION CATHETER PROVIDES A REAL-TIME MEASUREMENT OF CONTACT FORCE BETWEEN THE CATHETER TIP AND HEART WALL, AS WELL AS LOCATION INFORMATION WHEN USED WITH CARTO 3 NAVIGATION SYSTEM.",Cardiac Ablation Percutaneous Catheter,Unknown,,3
P040026,,"MEDISPEC, LTD.",203 PERRY PARKWAY,Suite 6,GAITHERSBURG,MD,20877,,"Generator, shock-wave, for pain relief",ORTHOSPEC EXTRACORPOREAL SHOCK WAVE THERAPY DEVICE,NBN,PM,Physical Medicine,,,N,2004-06-04,2005-04-01,05M-0241,2005-06-20,APPR,APPROVAL FOR THE ORTHOSPEC EXTRACORPOREAL SHOCK WAVE THERAPY DEVICE.  THE DEVICE IS INDICATED FOR THE TREATMENT OF PROXIMAL PLANTAR FASCIITIS WITH OR WITHOUT HEEL SPUR IN PATIENTS 18 YEARS OF AGE OR OLDER.  THE ORTHOSPEC EXTRACORPOREAL SHOCK WAVE THERAPY IS A NON-INVASIVE ALTERNATIVE METHOD FOR PATIENT WITH SYMPTOMS OF PROXIMAL PLANTAR FASCIITIS FOR 6 MONTHS OR MORE AND A HISTORY OF UNSUCCESSFUL CONSERVATIVE THERAPIES TO RELIEVE HEEL PAIN.  PROXIMAL PLANTAR FASCIITIS IS DEFINED AS HEEL PAIN IN THE AREA OF THE INSERTION OF THE PLANTAR FASCIA ON THE PLANTAR CALCANEAL TUBEROSITY.,"Generator, Shock-Wave, For Pain Relief",Unknown,,3
P100034,,Novocure GmbH,Park 6,,CH-6039 Root D4,,,,"Stimulator, low electric field, tumor treatment",NOVOCURE LTD'S NOVOTTF-100A TREATMENT KIT,NZK,NE,Neurology,,,Y,2010-08-16,2011-04-08,11M-0295,2011-05-06,APPR,"APPROVAL FOR THE NOVOTTF-100A SYSTEM.  THE DEVICE IS INDICATED FOR TREATMENT OF ADULT PATIENTS (22 YEARS OF AGE OR OLDER) WITH HISTOLOGICALLY- CONFIRMED GLIOBLASTOMA MULTIFORME, FOLLOWING HISTOLOGICALLY- OR RADIOLOGICALLY- CONFIRMED RECURRENCE IN THE SUPRATENTORIAL REGION OF THE BRAIN AFTER RECEIVING CHEMOTHERAPY.  THE DEVICE IS INTENDED TO BE USED AS A MONOTHERAPY, AND IS INTENDED AS AN ALTERNATIVE TO STANDARD MEDICAL THERAPY FOR GBM AFTER SURGICAL AND RADIATION OPTIONS HAVE BEEN EXHAUSTED.","Stimulator, Low Electric Field, Tumor Treatment",Unknown,,3
P960058,S049,ADVANCED BIONICS,28515 WESTINGHOUSE PLACE,,VALENCIA,CA,91355,,"Implant, cochlear",HARMONY HIRESOLUTION BIONIC EAR SYSTEM,MCM,EN,"Ear, Nose, Throat",Normal 180 Day Track,Change Design/Components/Specifications/Material,N,2005-12-12,2006-08-17,,,APPR,"APPROVAL FOR A MODIFICATION TO THE SOUNDWAVE PROFESSIONAL SUITE SOFTWARE (SOUNDWAVE VERSION 1.4) WHICH IMPLEMENTS AN OPTIONAL FEATURE, KNOWN AS FIDELITY 120, AND ADDS SUPPORT FOR THE AURIA HARMONY SOUND PROCESSOR.  THE SOFTWARE, AS MODIFIED, WILL BE MARKETED UNDER THE TRADE NAME SOUNDWAVE PROFESSIONAL SUITE VERSION 1.4 AND IS INDICATED FOR ADULT PATIENTS AND PEDIATRIC PATIENTS AGED 12-MONTHS THROUGH 17 YEARS, 11-MONTHS.  HOWEVER, THE OPTIONAL SOFTWARE CAPABILITY KNOWN AS FIDELITY 120 (SPEECH ENCODING STRATEGY) IS LIMITED FOR USE IN ADULTS WITH 1) POST-LINGUAL ONSET OF SEVERE OR PROFOUND HEARING LOSS, 2) A MINIMUM OF THREE-MONTHS EXPERIENCE WITH STANDARD HIRES, AND 3) WHO HAVE THE COGNITIVE ABILITY TO CHOOSE THE SOUND PROCESSING OPTIONS.","Implant, Cochlear",Unknown,,3
P940022,S016,ADVANCED BIONICS CORP.,12740 SAN FERNANDO RD.,,SYLMAR,CA,91342,,"Implant, cochlear",MULTI-STRATEGY COCHLEAR IMPLANT-PLATINUM BTE SOUND PROCESSOR (ADULT),MCM,EN,"Ear, Nose, Throat",Normal 180 Day Track,Change Design/Components/Specifications/Material,N,2000-11-16,2001-01-12,,,APPR,"APPROVAL FOR INCORPORATION OF THE SIZE-REDUCED SPEECH PROCESSOR TO BE WORN BEHIND THE EAR, KNOWN AS THE PLATINUM BTE(TM) SOUND PROCESSOR.  THE DEVICE, AS MODIFIED, WILL BE MARKETED UNDER THE TRADE NAME CLARION(R) MULTI-STRATEGY COCHLEAR IMPLANT PLATINUM BTE SOUND PROCESSOR.  THE DEVICE IS INDICATED TO RESTORE A LEVEL OF AUDITORY SENSATION TO INDIVIDUALS WITH PROFOUND SENSORINEURAL DEAFNESS VIA ELECTRICAL STIMULATION OF THE AUDITORY NERVE.  ADULTS:  1) 18 YEARS OF AGE OR OLDER  2) PROFOUND, BILATERAL SENSORINEURAL DEAFNESS (>=90DB)  3) POSTLINGUALLY DEAFENED  4) LACK OF BENEFIT FROM APPROPRIATELY FITTED HEARING AIDS.","Implant, Cochlear",Unknown,,3
P030031,S025,"BIOSENSE WEBSTER, INC.",31 Technology Drive,Suite 200,Irvine,CA,92618,,"catheter, percutaneous, cardiac ablation, for treatment of atrial flutter","THERMOCOOL SF NAV BI-DIRECTIONAL CATHETER (D-1313-XX-S, D-1317-XX-S) AND THERMOCOOL SF BI-DIRECTIONAL CATHETER",OAD,CV,Cardiovascular,Normal 180 Day Track,Change Design/Components/Specifications/Material,N,2010-01-15,2011-12-21,,,APPR,"APPROVAL FOR THE FOLLOWING DEVICE MODIFICATIONS:1) REDUCED RECOMMENDED SALINE FLOW RATE (REDUCE BY ~50%); 2) INCREASE IN NUMBER OF IRRIGATION HOLES (FROM 6 TO 56); 3) DECREASE IN SIZE OF IRRIGATION HOLES (FROM 0.016"" TO 0.0035"" DIAMETER);4) MODIFIED TIP ELECTRODE MATERIAL (FROM 90% PLATINUM/10% IRIDIUM TO 80% PALLADIUM/20% PLATINUM); AND 5) UPDATE STOCKERT 70 RF GENERATOR SOFTWARE (VL.035 TO VL.037).  THE DEVICE, AS MODIFIED, WILL BE MARKETED UNDER THE TRADE NAMES BI-DIRECTIONAL CARTO XP THERMOCOOL SF NAY CATHETER, BI-DIRECTIONAL CARTO 3 THERMOCOOL SF NAY CATHETER, AND BIDIRECTIONALTHERMOCOOL SF CATHETER AND IS INDICATED FOR:THE BIOSENSE WEBSTER THERMOCOOL SF NAV DIAGNOSTIC/ ABLATION DEFLECTABLE TIP CATHETER AND RELATED ACCESSORY DEVICES ARE INDICATED FOR CATHETER BASED CARDIAC ELECTROPHYSIOLOGICAL MAPPING (STIMULATING AND RECORDING) AND, WHEN USED WITH A COMPATIBLE RF GENERATOR, FOR THE TREATMENT OF 1) TYPE I ATRIAL FLUTTER IN PATIENTS AGE 18 OR OLDER; AND 2) DRUG REFRACTORY RECURRENT SYMPTOMATIC PAROXYSMAL ATRIAL FIBRILLATION, WHEN USED WITH COMPATIBLE THREE-DIMENSIONAL ELECTROANATOMIC MAPPING SYSTEMS.THE THERMOCOOL SF NAV DIAGNOSTIC/ ABLATION DEFLECTABLE TIP CATHETER PROVIDES LOCATION INFORMATION WHEN USED WITH COMPATIBLE CARTO EP NAVIGATION SYSTEMS.  THE BIOSENSE WEBSTER THERMOCOOL SF DIAGNOSTIC/ABLATION DEFLECTABLE TIP CATHETER ANDRELATED ACCESSORIES ARE INDICATED FOR USE IN CATHETER-BASED CARDIAC ELECTROPHYSIOLOGICALMAPPING (STIMULATING AND RECORDING) AND, WHEN USED WITH A COMPATIBLE RF GENERATOR, FOR THETREATMENT OF TYPE I ATRIAL FLUTTER IN PATIENTS AGE 18 OR OLDER.","Catheter, Percutaneous, Cardiac Ablation, For Treatment Of Atrial Flutter",Unknown,,3
P050034,S013,Samsara Vision Inc.,27 US Highway 202,Suite 8/9,Far Hills,NJ,07931,,"Telescope, implantable, miniature",IMPLANTABLE MINIATURE TELESCOPE MODELS WIDE ANGLE 2.2X AND WIDE ANGLE 2.7X,NCJ,OP,Ophthalmic,Normal 180 Day Track,Labeling Change - Indications/instructions/shelf life/tradename,N,2013-12-26,2014-10-08,,,APPR,"APPROVAL TO MODIFY THE INDICATIONS FOR USE FOR THE IMT TO INCLUDE PATIENTS 65 TO 74 YEARS OF AGE FROM THE CURRENT MINIMUM OF 75 YEARS, TO REVISE THE PROFESSIONAL AND PATIENT LABELING TO UPDATE THE DATA BASED ON THE RESULTS OUT TO 8-YEARS POST IMT IMPLANTATION, AND TO REVISE THE ACCEPTANCE OF RISK AND INFORMED DECISION AGREEMENT, AS WELL AS THE PROFESSIONAL AND PATIENT LABELING, TO EMPHASIZE THAT THE LONGER THE IMT IS IN THE EYE, THE GREATER THE POTENTIAL RISK OF DEVELOPING VISION-IMPAIRING CORNEAL EDEMA WHICH MAY LEAD TO THE NEED FOR CORNEAL TRANSPLANT AND POSSIBLE TELESCOPE REMOVAL.THE DEVICE, AS MODIFIED, WILL BE MARKETED UNDER THE TRADE NAME IMPLANTABLE MINIATURE TELESCOPETM (BY DR. ISAAC LIPSHITZ) (IMT) MODELS WIDE ANGLE 2.2X AND WIDE ANGLE 2.7X AND IS INDICATED FOR MONOCULAR IMPLANTATION TO IMPROVE VISION IN PATIENTS GREATER THAN OR EQUAL TO 65 YEARS OF AGE WITH STABLE SEVERE TO PROFOUND VISION IMPAIRMENT (BEST CORRECTED DISTANCE VISUALACUITY 20/160 TO 20/800) CAUSED BY BILATERAL CENTRAL SCOTOMAS ASSOCIATED WITH END-STAGE AGE-RELATED MACULAR DEGENERATION. PATIENTS MUST:1) HAVE RETINAL FINDINGS OF GEOGRAPHIC ATROPHY OR DISCIFORM SCAR WITH FOVEAL INVOLVEMENT, AS DETERMINED BY FLUORESCEIN ANGIOGRAPHY; 2) HAVE EVIDENCE OF VISUALLY SIGNIFICANT CATARACT (>= GRADE 2); 3) AGREE TO UNDERGO PRE-SURGERY TRAINING AND ASSESSMENT (TYPICALLY 2 TO 4 SESSIONS) WITH LOW VISION SPECIALISTS (OPTOMETRIST OR OCCUPATIONAL THERAPIST) IN THE USE OF AN EXTERNAL TELESCOPE SUFFICIENT FOR PATIENT ASSESSMENT AND FOR THE PATIENT TO MAKE AN INFORMED DECISION; 4) ACHIEVE AT LEAST A 5-LETTER IMPROVEMENT ON THE ETDRS CHART WITH AN EXTERNAL TELESCOPE; 5) HAVE ADEQUATE PERIPHERAL VISION IN THE EYE NOT SCHEDULED FOR SURGERY; AND 6) AGREE TO PARTICIPATE IN POSTOPERATIVE VISUAL TRAINING WITH A LOW VISION SPECIALIST.","Telescope, Implantable, Miniature",Unknown,,3
P990027,S015,TECHNOLAS PERFECT VISION GMBH,MESSERSCHMITTSTR 1 + 3,,MUNCHEN,,80992,,Excimer laser system,TECHNOLAS PERFECT VISION 217Z ZYOPTIX SYSTEM FOR PERSONALIZED VISION CORRECTION,LZS,OP,Ophthalmic,Normal 180 Day Track,Change Design/Components/Specifications/Material,N,2010-06-29,2010-11-30,,,APPR,"APPROVAL FOR THE ADVANCED NOMOGRAM SOFTWARE MODULE AS AN UPGRADE TO THE EXISTING SOFTWARE OF THE TECHNOLAS PERFECT VISION® 217Z ZYOPTIX SYSTEM FOR PERSONALIZED VISION CORRECTION. THE ADVANCED NOMOGRAM RESIDES ON A SEPARATE COMPUTER WITH THE ZYLINK TREATMENTCALCULATION SOFTWARE, AND IT LEAVES ALL HARDWARE COMPONENTS AND THE LASER BEAM CONTROL SOFTWARE MODULE UNCHANGED. THE TECHNOLAS PERFECT VISION 217Z ZYOPTIX SYSTEM FOR PERSONALIZEDVISION CORRECTION WITH ADVANCED NOMOGRAM SOFTWARE MODULE IS INDICATED FOR WAVEFRONT-GUIDEDLASER ASSISTED IN-SITU KERATOMILEUSIS (LASIK):1) FOR THE REDUCTION OR ELIMINATION OF MYOPIA WITH SPHERE UP TO -7.00 D AND CYLINDER UP TO-3.00 D AND MRSE <=7.50 D AT THE SPECTACLE PLANE;2) IN PATIENTS WITH DOCUMENTED EVIDENCE OF A CHANGE IN MANIFEST REFRACTION OF LESS THAN OREQUAL TO +-0.50 DIOPTERS (IN BOTH CYLINDER AND SPHERE COMPONENTS) FOR AT LEAST ONE YEARPRIOR TO THE DATE OF THE PRE-OPERATIVE EXAMINATION; AND3) IN PATIENTS 21 YEARS OF AGE OR OLDER.",Excimer Laser System,Unknown,,3
P170039,,HumanOptics AG,Spardorfer Strasse 150,,Erlangen,,91054,,Artificial iris,CustomFlex Artificial Iris,QBT,OP,Ophthalmic,,,N,2017-11-29,2018-05-30,,,APPR,"Approval for the  CustomFlex Artificial Iris.  The CustomFlex Artificial Iris is indicated for use in children and adults for the treatment of full or partial aniridia resulting from congenital aniridia, acquired defects, or other conditions associated with full or partial aniridia.",Artificial Iris,Unknown,,3
P170024,,Stryker Neurovascular,47900 Bayside Parkway,,Fremont,CA,94538,,Intracranial aneurysm flow diverter,Surpass Streamline Flow Diverter,OUT,NE,Neurology,,,N,2017-07-31,2018-07-13,18M-2884,2018-07-26,APPR,Approval for The Surpass Streamline Flow Diverter.  The Surpass Streamline Flow Diverter is indicated for use in the endovascular treatment of patients (18 years of age and older) with unruptured large or giant saccular wide-neck (neck width >= 4 mm or dome-to-neck ratio < 2) or fusiform intracranial aneurysms in the internal carotid artery from the petrous segment to the terminus arising from a parent vessel with a diameter >= 2.5 mm and <= 5.3 mm.,Intracranial Aneurysm Flow Diverter,Unknown,,3
P950005,S018,"Biosense Webster, Inc",31 Technology Drive,Suite 200,Irvine,CA,92618,,"CATHETER, ELECTRODE RECORDING, OR PROBE, ELECTRODE RECORDING","CELSIUS RMT DIAGNOSTIC/ABLATION DEFLECTABLE TIP CATHETERS, MODEL D-1249-02-S",DRF,CV,Cardiovascular,Normal 180 Day Track,Change Design/Components/Specifications/Material,N,2004-09-28,2005-12-16,,,APPR,"APPROVAL FOR ADDING REMOTE MAGNETIC NAVIGATION TECHNOLOGY TO THE PREVIOUSLY APPROVED CATHETER.  THE DEVICE, AS MODIFIED, WILL BE MARKETED UNDER THE TRADE NAME CELSIUS RMT DIAGNOSTIC/ABLATION DEFLECTABLE TIP CATHETERS AND IS INDICATED FOR CATHETER-BASED ATRIAL AND VENTRICULAR ELECTROPHYSIOLOGIC MAPPING AND FOR USE WITH THE STEREOTAXIS MAGNETIC NAVIGATION SYSTEM (MNS) AND COMPATIBLE RADIOFREQUENCY GENERATORS IN ADULTS AND CHILDREN FOUR (4) YEARS OF AGE OR OLDER IN CREATING ENDOCARDIAL LESIONS DURING CARDIAC ABLATION PROCEDURES TO TREAT ARRHYTHMIAS.","Catheter, Electrode Recording, Or Probe, Electrode Recording",Cardiovascular,870.1220,2
P960058,S043,ADVANCED BIONICS,28515 WESTINGHOUSE PLACE,,VALENCIA,CA,91355,,"Implant, cochlear",HIRESOLUTION BIONIC EAR SYSTEM,MCM,EN,"Ear, Nose, Throat",Normal 180 Day Track,Change Design/Components/Specifications/Material,N,2005-07-05,2005-12-23,,,APPR,"APPROVAL FOR PROCESS CONTROL IMPROVEMENTS TO THE HIRES90K COIL-CASE/ELECTRODE SUBASSEMBLY FINAL MOLDING PROCESS.  THE PROPOSED CHANGES INCLUDE AN EXTERNAL THERMOCOUPLE TO PROVIDE CLOSED-LOOP CONTROL OF THE MOLD TEMPERATURE, THEREBY PROVIDING BETTER CONTROL OF THE CURING TEMPERATURE OF THE SILICONE, AND BY CONFIGURING THE MOLD TOOL WITH SPRING WASHER (BELLEVILLE WASHERS) TO ALLOW FOR SMOOTHER MOVEMENT.  THE DEVICE, AS MODIFIED, WILL BE MARKETED UNDER THE TRADE NAME HIRESOLUTION BIONIC EAR SYSTEM AND IS INDICATED FOR INDIVIDUALS AGED 12 MONTHS AND OLDER WITH SEVERE-TO-PROFOUND SENSORINEURAL HEARING LOSS TO RESTORE A LEVEL OF AUDITORY SENSATION VIA ELECTRICAL STIMULATION OF THE AUDITORY NERVE.","Implant, Cochlear",Unknown,,3
P130007,S004,ANIMAS CORP.,965 CHESTERBROOK BLVD.,,WAYNE,PA,19087,,"Sensor, glucose, invasive",ANIMAS VIBE SYSTEM,MDS,CH,Clinical Chemistry,Panel Track,Labeling Change - Indications/instructions/shelf life/tradename,N,2015-04-30,2015-12-24,16M-0120,2016-02-12,APPR,"APPROVAL FOR THE ANIMAS VIBE SYSTEM. THE ANIMAS® VIBE SYSTEM CONSISTS OF THE ANIMAS VIBE INSULIN PUMP PAIRED WITH THE DEXCOM G4 PLATINUM CGM SENSOR AND TRANSMITTER.THE ANIMAS VIBE INSULIN PUMP IS INTENDED FOR THE CONTINUOUS SUBCUTANEOUS INFUSION OF INSULIN FOR THE MANAGEMENT OF INSULIN-REQUIRING DIABETES. IT CAN BE USED SOLELY FOR CONTINUOUS INSULIN DELIVERY OR AS PART OF THE ANIMAS VIBE SYSTEM TO RECEIVE AND DISPLAY CONTINUOUS GLUCOSE MEASUREMENTS FROM THE DEXCOM G4 PLATINUM SENSOR AND TRANSMITTER.  THE ANIMAS VIBE SYSTEMS CONTINUOUS GLUCOSE MONITORING (CGM) IS INDICATED FOR DETECTING TRENDS AND TRACKING PATTERNS IN PERSONS (AGE 2 AND OLDER) WITH DIABETES, AND IS INTENDED TO COMPLEMENT, NOT REPLACE, INFORMATION OBTAINED FROM STANDARD HOME GLUCOSE MONITORING DEVICES. CGM AIDS IN THE DETECTION OF EPISODES OF HYPERGLYCEMIA AND HYPOGLYCEMIA, FACILITATING BOTH ACUTE AND LONG TERM THERAPY ADJUSTMENTS, WHICH MAY MINIMIZE THESE EXCURSIONS. INTERPRETATION OF RESULTS FROM THE DEXCOM G4 PLATINUM SENSOR AND TRANSMITTER SHOULD BE BASED ON THE TRENDS AND PATTERNS SEEN WITH SEVERAL SEQUENTIAL READINGS OVER TIME.THE ANIMAS VIBE SYSTEM IS INTENDED FOR SINGLE PATIENT USE IN PERSONS AGE 2 AND OLDER AND REQUIRES A PRESCRIPTION.","Sensor, Glucose, Invasive",Unknown,,3
P990052,,Med-el Elektromedizinische Gerate GmbH,FUERSTENWEG 77A,A-6020,"INNSBRUCK, TIROL",,,,"Implant, hearing, active, middle ear, partially implanted",VIBRANT P/ VIBRANT D SOUNDBRIDGE SYSTEM,MPV,EN,"Ear, Nose, Throat",,,N,1999-09-07,2000-08-31,00M-1583,2000-10-27,APPR,"APPROVAL FOR THE VIBRANT SOUNDBRIDGE SYSTEM.  THIS DEVICE IS INDICATED FOR PROVIDING A USEFUL LEVEL OF SOUND PERCEPTION TO INDIVIDUALS VIA MECHANICAL STIMULATINO OF THE OSSICLES.  THE VIBRANT SOUNDBRIDGE IS INTENDED FOR USE IN ADULTS, 18 YEARS OF AGE OR OLDER, WHO HAVE A MODERATE TO SEVERE SENSORINEURAL HEARING LOSS AND DESIRE AN ALTERNATIVE TO AN ACOUSTIC HEARING AID.  PRIOR TO RECEIVING THE DEVICE, IT IS RECOMMENDED THAT AN INDIVIDUAL HAVE EXPERIENCE WITH APPROPRIATELY FIT HEARING AIDS.","Implant, Hearing, Active, Middle Ear, Partially Implanted",Unknown,,3
P020050,S023,"Alcon Laboratories, Inc.",6201 South Freeway,,Fort Worth,TX,76134,2099,Excimer laser system,"WAVELIGHT EX500 EXCIMER LASER SYSTEM, ALLEGRETTO WAVE EYE-Q EXCIMER LASER SYSTEM",LZS,OP,Ophthalmic,Panel Track,Labeling Change - Indications/instructions/shelf life/tradename,N,2015-07-20,2016-11-21,16M-4046,2016-11-30,APPR,"Approval for the WaveLight EX500 Excimer Laser System and Allegretto Wave Eye-Q Excimer Laser System. These devices are indicated for use in Photorefractive Keratectomy (PRK) treatments for:  1) the reduction or elimination of up to -6.0 diopters (D) of spherical equivalent myopia or myopia with astigmatism, with up to -6.0 D of spherical component and up to -3.0 D of astigmatic component at the spectacle plane;2)  patients who are 18 years of age or older; and  3) patients with documentation of a stable manifest refraction defined as <=0.5 D preoperative spherical equivalent shift over one year prior to surgery.",Excimer Laser System,Unknown,,3
P980022,S021,MEDTRONIC MINIMED,18000 DEVONSHIRE ST,,NORTHRIDGE,CA,91325,,"Sensor, glucose, invasive",PARADIGM REAL-TIME SYSTEM AND GUARDIAN REAL-TIME SYSTEM,MDS,CH,Clinical Chemistry,Normal 180 Day Track,Change Design/Components/Specifications/Material,N,2007-10-24,2008-04-18,,,APPR,"APPROVAL FOR AN OPTIONAL CAPABILITY OF AUTOMATICALLY DOWNLOADING GLUCOSE RESULTS FROM THE LIFESCAN ONETOUCH ULTRALINK BLOOD GLUCOSE METER IN ADDITION TO THE CURRENT BD PARADIGM LINK GLUCOSE METER. THIS MODIFICATION INCLUDES AN OPTIONAL CAPABILITY FOR THE MINIMED PARADIGM REAL-TIME INSULIN INFUSION PUMPS OR THE GUARDIAN REAL-TIME GLUCOSE MONITOR TO RECEIVE BLOOD GLUCOSE VALUES AUTOMATICALLY TRANSMITTED BY A LIFESCAN ONETOUCH ULTRALINK BLOOD GLUCOSE METER.  THE GUARDIAN? REAL-TIME SYSTEM IS INDICATED FOR CONTINUOUS OR PERIODIC MONITORING OF GLUCOSE LEVELS IN THE FLUID UNDER THE SKIN, IN CHILDREN AND ADULTS, AGES 7 AND UP, WITH DIABETES MELLITUS, FOR THE PURPOSE OF IMPROVING DIABETES MANAGEMENT. IT ALERTS IF A GLUCOSE LEVEL FALLS BELOW, OR RISES ABOVE, PRESET VALUES. VALUES ARE NOT INTENDED TO BE USED DIRECTLY FOR MAKING THERAPY ADJUSTMENTS, BUT RATHER TO PROVIDE AN INDICATION OF WHEN A FINGERSTICK MAY BE REQUIRED. ALL THERAPY ADJUSTMENTS SHOULD BE BASED ON MEASUREMENTS OBTAINED USING A HOME GLUCOSE MONITOR. THE SYSTEM PROVIDES REAL-TIME GLUCOSE VALUES THAT ALLOW USERS TO TRACK PATTERNS IN GLUCOSE CONCENTRATIONS AND TO POSSIBLY IDENTIFY EPISODES OF LOW AND HIGH BLOOD GLUCOSE. IT ALSO STORES THE DATA SO THAT IT CAN BE ANALYZED TO TRACK PATTERNS.  GLUCOSE DATA CAN BE FURTHER DOWNLOADED TO PC SOFTWARE FOR ANALYSIS OF HISTORICAL GLUCOSE VALUES.  THE GUARDIAN REAL-TIME MONITOR CAN BE PROGRAMMED TO RECEIVE FINGERSTICK BLOOD GLUCOSE CALIBRATION VALUES TRANSMITTED FROM THE BD PARADIGM LINK OR LIFESCAN ONETOUCH ULTRALINK GLUCOSE METERS.  CALIBRATION VALUES FROM OTHER GLUCOSE METERS MUST BE MANUALLY ENTERED INTO THE MONITOR.  THE PARADIGM? REAL-TIME SYSTEM IS INDICATED FOR CONTINUOUS OR PERIODIC MONITORING OF GLUCOSE LEVELS IN THE FLUID UNDER THE SKIN, AND POSSIBLE LOW AND HIGH BLOOD GLUCOSE EPISODES IN CHILDREN AND ADULTS, AGES 7 AND UP....(SEE APPROVAL ORDER FOR ADDITIONAL INFO)","Sensor, Glucose, Invasive",Unknown,,3
