pma_number,supplement_number,applicant,street_1,street_2,city,state,zip,zip_ext,generic_name,trade_name,product_code,advisory_committee,advisory_committee_description,supplement_type,supplement_reason,expedited_review_flag,date_received,decision_date,docket_number,fed_reg_notice_date,decision_code,ao_statement,device_name,medical_specialty_description,regulation_number,device_class
P120010,S046,MEDTRONIC Inc.,18000 DEVONSHIRE STREET,,NORTHRIDGE,CA,91325,1219,"Automated insulin dosing , threshold suspend",MINIMED 530G INSULIN PUMP,OZO,CH,Clinical Chemistry,Panel Track,Labeling Change - Indications/instructions/shelf life/tradename,N,2014-12-10,2015-10-02,15M-4013,2015-11-02,APPR,"APPROVAL FOR THE MINIMED 530G SYSTEM WITH THRESHOLD SUSPEND FEATURING SMARTGUARD TECHNOLOGY. THIS DEVICE IS INDICATED FOR THE FOLLOWING:THE MINIMED 530G SYSTEM IS INTENDED FOR CONTINUOUS DELIVERY OF BASAL INSULIN (AT USER SELECTABLE RATES) AND ADMINISTRATION OF INSULIN BOLUSES (IN USER SELECTABLE AMOUNTS) FOR THE MANAGEMENT OF DIABETES MELLITUS IN PERSONS, SIXTEEN YEARS OF AGE AND OLDER, REQUIRING INSULIN AS WELL AS FOR THE CONTINUOUS MONITORING AND TRENDING OF GLUCOSE LEVELS IN THE FLUID UNDER THE SKIN. THE MINIMED 530G SYSTEM CAN BE PROGRAMMED TO AUTOMATICALLY SUSPEND DELIVERY OF INSULIN WHEN THE SENSOR GLUCOSE VALUE FALLS BELOW A PREDEFINED THRESHOLD VALUE. THE MINIMED 530G SYSTEM CONSISTS OF THE FOLLOWING DEVICES THAT CAN BE USED IN COMBINATION OR INDIVIDUALLY: MINIMED 530G INSULIN PUMP, ENLITE SENSOR, ENLITE SERTER, THE MINILINK REAL-TIME SYSTEM, THE BAYER CONTOUR NEXTLINK GLUCOSE METER, CARELINK PROFESSIONAL THERAPY MANAGEMENT SOFTWARE FOR DIABETES, AND CARELINK PERSONAL THERAPY MANAGEMENT SOFTWARE FOR DIABETES. THE SYSTEM REQUIRES A PRESCRIPTION.THE MINIMED 530G SYSTEM IS NOT INTENDED TO BE USED DIRECTLY FOR MAKING THERAPY ADJUSTMENTS, BUT RATHER TO PROVIDE AN INDICATION OF WHEN A FINGER STICK MAY BE REQUIRED. ALL THERAPY ADJUSTMENTS SHOULD BE BASED ON MEASUREMENTS OBTAINED USING A HOME GLUCOSE MONITOR AND NOT ON VALUES PROVIDED BY THE MINIMED 530G SYSTEM.  THE MINIMED 530G SYSTEM IS NOT INTENDED TO BE USED DIRECTLY FOR PREVENTING OR TREATING HYPOGLYCEMIA BUT TO SUSPEND INSULIN DELIVERY WHEN THE USER IS UNABLE TO RESPOND TO THETHRESHOLD SUSPEND ALARM TO TAKE MEASURES TO PREVENT OR TREAT  HYPOGLYCEMIA HIMSELF.  THERAPY TO PREVENT OR TREAT HYPOGLYCEMIA SHOULD BE ADMINISTERED ACCORDING TO THERECOMMENDATIONS OF THE USER¿S HEALTH CARE PROVIDER.","Automated Insulin Dosing , Threshold Suspend",Unknown,,3
P090022,S011,"LENSTEC, INC.",1765 COMMERCE AVE N,,ST. PETERSBURG,FL,33716,,intraocular lens,SOFTEC HD POSTERIOR CHAMBER INTRAOCULAR LENS (PCIOL),HQL,OP,Ophthalmic,Real-Time Process,Change Design/Components/Specifications/Material,N,2012-03-14,2012-06-11,,,APPR,"APPROVAL FOR MODIFICATIONS TO THE OPTIC BODY SHAPE AND OVERALLDIAMETER OF YOUR SOFTEC HD LENS TO INTRODUCE A LENS WITH AN OVOID OPTIC AND OVERALL DIAMETER OF 12.50 MM AND CHANGES TO YOUR LABELING RELATED TO THE INTRODUCTION OF THE MODIFIED LENS. THE DEVICE, AS MODIFIED, WILL BE MARKETED UNDER THE TRADE NAME SOFTEC HDO AND IS INDICATED FOR THE REPLACEMENT OF THE HUMAN CRYSTALLINE LENS FOLLOWING PHACOEMULSIFICA- TION CATARACT REMOVAL IN ADULTS OVER THE AGE OF 21. THE LENS IS  INDICATED FOR CAPSULAR BAG PLACEMENT.",Intraocular Lens,Ophthalmic,886.3600,3
P060035,,Abbott Laboratories,100 ABBOTT PARK RD.,"AP5N-2, DEPT. 09VB",ABBOTT PARK,IL,60064,3500,"Test, hepatitis b (b core, be antigen, be antibody, b core igm)",ARCHITECT CORE-M REAGENT KIT/CALIBRATORS/CONTROLS,LOM,MI,Microbiology,,,N,2006-12-01,2007-11-06,07M-0447,2007-11-19,APPR,"APPROVAL FOR THE ARCHITECT CORE-M REAGENT KITARCHITECT CORE-M CALIBRATORS ANDARCHITECT CORE-M CONTROLS.  THE DEVICES IS INDICTED FOR: THE ARCHITECT CORE-M ASSAY IS A CHEMILUMINESCENT MICROPARTICLE IMMUNOASSAY (CMIA) FOR THE QUALITATIVE DETECTION OF IGM ANTIBODY TO HEPATITIS B CORE ANTIGEN (IGM ANTI-HBC) IN HUMAN ADULT AND PEDIATRIC SERUM OR PLASMA (DIPOTASSIUM EDTA, LITHIUM HEPARIN, AND SODIUM HEPARIN) AND NEONATAL SERUM. A TEST FOR IGM ANTI-HBC IS INDICATED AS AN AID IN THE DIAGNOSIS OF ACUTE OR RECENT HEPATITIS B VIRUS (HBV) INFECTION IN CONJUNCTION WITH OTHER LABORATORY RESULTS AND CLINICAL INFORMATION.  THE ARCHITECT CORE-M CALIBRATORS ARE USED FOR THE CALIBRATION OF THE ARCHITECT I SYSTEM WHEN THE SYSTEM IS USED FOR THE QUALITATIVE DETECTION OF IGM ANTIBODY TO HEPATITIS B CORE ANTIGEN (IGM ANTI-HBC) USING THE ARCHITECT CORE-M REAGENT KIT. THE PERFORMANCE OF THE ARCHITECT CORE-M CALIBRATORS HAS NOT BEEN ESTABLISHED WITH ANY OTHER IGM ANTI-HBC ASSAYS. THE ARCHITECT CORE-M CONTROLS ARE USED FOR MONITORING THE PERFORMANCE OF THE ARCHITECT I SYSTEM WHEN USED FOR THE QUALITATIVE DETECTION OF IGM ANTIBODY TO HEPATITIS B CORE ANTIGEN (IGM ANTI-HBC) IN HUMAN ADULT SERUM AND PLASMA WHEN USING THE ARCHITECT CORE-M REAGENT KIT. THE PERFORMANCE OF THE ARCHITECT CORE-M CONTROLS HAS NOT BEEN ESTABLISHED WITH ANY OTHER IGM ANTI-HBC ASSAYS.","Test, Hepatitis B (B Core, Be Antigen, Be Antibody, B Core Igm)",Unknown,,3
P160029,,"PHILIPS MEDICAL SYSTEMS, INC.",22100 BOTHELL -EVERETT HWY,,BOTHELL,WA,98021,,Over-the-counter automated external defibrillator,HeartStart OnSite Defibrillator (Model M5066A) and HeartStart Home Defibrillator (Model M5068A),NSA,CV,Cardiovascular,,,N,2016-07-29,2019-06-06,19M-2782,2019-07-02,APPR,"Approval for the HeartStart OnSite Defibrillator (Model M5066A) and HeartStart Home Defibrillator (Model M5068A).  The HeartStart OnSite Defibrillator (M5066A) is indicated for use on potential victims of sudden cardiac arrest with the following symptoms:1) Unconsciousness; and 2) Absence of normal breathing.The HeartStart OnSite (Model M5066A) is indicated for adults over 55 pounds (25 kg). It is also indicated for infants and children under 55 lbs (25 kg) or 8 years old when used with the optional infant/child SMART pads. If Infant/Child SMART pads are not available, or you are uncertain of the childs age or weight, proceed with treatment using adult SMART pads.The HeartStart Home Defibrillator (M5068A) is indicated for use on potential victims of cardiac arrest with the following symptoms: 1) Unconsciousness; and 2) Absence of normal breathing. The HeartStart Home (M5068A) is indicated for adults over 55 pounds (25 kg).  They are also indicated for infants and children under 55 lbs (25 kg) or 8 years old when used with the optional infant/child SMART pads.  If Infant/Child SMART pads are not available, or you are uncertain of the childs age or weight, proceed with treatment using adult SMART pads.",Over-The-Counter Automated External Defibrillator,Cardiovascular,870.5310,3
P990052,S019,Med-el Elektromedizinische Gerate GmbH,FUERSTENWEG 77A,A-6020,"INNSBRUCK, TIROL",,,,"Implant, hearing, active, middle ear, partially implanted",VIBRANT SOUNDBRIDGE EAR IMPLANT SYSTEM,MPV,EN,"Ear, Nose, Throat",Real-Time Process,Change Design/Components/Specifications/Material,N,2008-01-22,2008-03-25,,,APPR,"APPROVAL FOR A MINOR SOFTWARE CHANGE TO THE CURRENTLY APPROVED SYMFIT MODULE AND IS INDICATED FOR ADULTS, 18 YEARS OF AGE OR OLDER, WHO HAVE A MODERATE TO SEVERE SENSORINEURAL HEARING LOSS.  PRIOR TO RECEIVING THE DEVICE, IT IS RECOMMENDED THAT AN INDIVIDUAL HAVE EXPERIENCE WITH APPROPRIATELY FIT HEARING AIDS.","Implant, Hearing, Active, Middle Ear, Partially Implanted",Unknown,,3
P990056,,ROCHE DIAGNOSTICS CORP.,9115 HAGUE RD.,,INDIANAPOLIS,IN,46250,,"Total, prostate specific antigen (noncomplexed & complexed) for detection of prostate cancer",ELECSYS TOTAL PSA IMMUNOASSAY AND TOTAL PSA CALSET,MTF,IM,Immunology,,,N,1999-10-04,2000-11-22,00M-1660,2000-12-12,APPR,"APPROVAL FOR THE ELECSYS(R) TOTAL PSA IMMUNOASSAY AND ELECSYS(R) TOTAL PSA CALSET.  THE DEVICE, A QUANTITATIVE IN VITRO DIAGNOSTIC TEST FOR TOTAL PROSTATE-SPECIFIC ANTIGEN (TPSA) IN HUMAN SERUM AND PLASMA IS INDICATED FOR THE MEASUREMENT OF TOTAL PSA IN CONJUNCTION WITH DOGOTA; RECTAL EXAM (DRE) AS AN AID IN THE DETECTION OF PROSTATE CANCER IN MEN AGED 50 YEARS OR OLDER.  PROSTATE BIOPSY IS REQUIRED FOR THE DIAGNOSIS OF PROSTATE CANCER.  THE TEST ID FURTHER INDICATED FOR SERIAL MEASUREMENT OF TPSA TO AID IN THE MANAGEMENT OF PROSTATE CANCER PATIENTS.  THE ELECTOCHEMILUMINESCENCE IMMUNOASSAY ""ECLIA"" IS INTENDED FOR USE ON THE ROCHE ELECSYS(R) 1010 AND 2010 IMMUNOASSAY ANALYZERS.","Total, Prostate Specific Antigen (Noncomplexed & Complexed) For Detection Of Prostate Cancer",Unknown,,3
P020056,S002,Allergan,2525 DUPONT DR.,,IRVINE,CA,92612,,"Prosthesis, breast, noninflatable, internal, silicone gel-filled",NATRELLE SILICONE-FILLED BREAST IMPLANTS,FTR,SU,"General, Plastic Surgery",Normal 180 Day Track,Change Design/Components/Specifications/Material,N,2007-02-23,2007-05-02,,,APPR,"APPROVAL FOR THE DIPHENYL PATCH DESIGN.  THE DEVICE, AS MODIFIED, WILL BE MARKETED UNDER THE TRADE NAME NATRELLE SILICONE-FILLED BREAST IMPLANTS AND IS INDICATED FOR BREAST AUGMENTATION FOR WOMEN AT LEAST 22 YEARS OLD AND FOR BREAST RECONSTRUCTION FOR WOMEN OF ANY AGE.  BREAST AUGMENTATION INCLUDES PRIMARY BREAST AUGMENTATION TO INCREASE THE BREAST SIZE, AS WELL AS REVISION SURGERY TO CORRECT OR IMPROVE THE RESULT OF A PRIMARY BREAST AUGMENTATION SURGERY.  BREAST RECONSTRUCTION INCLUDES PRIMARY RECONSTRUCTION TO REPLACE BREAST TISSUE THAT HAS BEEN REMOVED DUE TO CANCER OR TRAUMA OR THAT HAS FAILED TO DEVELOP PROPERLY DUE TO A SEVERE BREAST ABNORMALITY.  BREAST RECONSTRUCTION ALSO INCLUDES REVISION SURGERY TO CORRECT OR IMPROVE THE RESULT OF A PRIMARY BREAST RECONSTRUCTION SURGERY.","Prosthesis, Breast, Noninflatable, Internal, Silicone Gel-Filled","General, Plastic Surgery",878.3540,3
P110039,,InSightec,5 NAHUM HETH STREET,,TIRAT-CARMEL,,39120,,"Ablation system, high intensity focused ultrasound (HIFU), MR-guided",EXABLATE,NRZ,SU,"General, Plastic Surgery",,,Y,2011-12-05,2012-10-18,12M-1085,2012-11-08,APPR,"APPROVAL FOR THE EXABLATE SYSTEM, MODEL 2000/2100 /2100 VI. THIS DEVICE IS INDICATED FOR PAIN PALLIATION OF METASTATIC BONE CANCER IN PATIENTS 18 YEARS OF AGE OR OLDER WHO ARE  SUFFERING FROM BONE PAIN DUE TO METASTATIC DISEASE AND WHO ARC FAILURES OF STANDARD RADIATION THERAPY, OR NOT CANDIDATES FOR, OR REFUSED RADIATION THERAPY. THE BONE TUMOR TO BE TREATED MUST BE VISIBLE ON NON-CONTRAST MR AND DEVICE ACCESSIBLE.","Ablation System, High Intensity Focused Ultrasound (Hifu), Mr-Guided",Unknown,,3
P100039,S001,SIEMENS HEALTHCARE DIAGNOSTICS INC.,511 BENEDICT AVE.,,TARRYTOWN,NY,10591,,"Test, hepatitis b (b core, be antigen, be antibody, b core igm)",ADVIA CENTAUR ANTI-HBS2 ASSAY,LOM,MI,Microbiology,Normal 180 Day Track,Change Design/Components/Specifications/Material,N,2012-04-30,2013-10-03,,,APPR,"APPROVAL FOR THE ADVIA CENTAUR ANTI-HBS2 (AHBS2) ASSAY AND ADVIACENTAUR ANTI-HBS2 (AHBS2) QUALITY CONTROL MATERIAL FOR USE ON THE ADVIA CENTAUR CP INSTRUMENT. THE DEVICE, AS MODIFIED, WILL BE MARKETED UNDER THE TRADE NAME ADVIA CENTAUR ANTI-HBS2 (AHBS2) ASSAY AND ADVIA CENTAUR ANTI-HBS2 (AHBS2) QUALITY CONTROL MATERIALAND IS INDICATED FOR: ADVIA CENTAUR ANTI-HBS2 (AHBS2) ASSAY - THE ADVIA CENTAUR ANTI-HBS2 ASSAY IS AN IN VITRO DIAGNOSTIC IMMUNOASSAY FOR THE QUALITATIVE AND QUANTITATIVE DETERMINATION OF TOTAL ANTIBODIES TO HEPATITIS B SURFACE ANTIGEN IN HUMAN ADULT, ADOLESCENT, AND PEDIATRIC SERUM OR PLASMA (EDT A, LITHIUM-HEPARINIZED, OR SODIUM-HEPARINIZED) AND NEONATAL SAMPLES USING THE ADVIA CENTAUR CP SYSTEM. THE ASSAY RESULTS MAY BE USED AS AN AID IN THE DETERMINATION OF SUSCEPTIBILITY TO HEPATITIS B VIRUS (HBV) INFECTION IN INDIVIDUALS PRIOR TO OR FOLLOWING HBV VACCINATION OR WHERE VACCINATION STATUS IS UNKNOWN. ASSAY RESULTS MAY BE USED WITH OTHER HBV SEROLOGICAL MARKERS FOR THE LABORATORY DIAGNOSIS OF HBV DISEASE ASSOCIATED WITH HBV INFECTION. A REACTIVE ASSAY RESULT WILL ALLOW A DIFFERENTIAL DIAGNOSIS IN INDIVIDUALSDISPLAYING SIGNS AND SYMPTOMS OF HEPATITIS IN WHOM ETIOLOGY IS UNKNOWN. THIS ASSAY HAS NOT BEEN FDA-CLEARED OR APPROVED FOR THE SCREENING OF BLOOD OR PLASMA DONORS ADVIA CENTAUR ANTI-HBS2 (AHBS2) QUALITY CONTROL MATERIAL - FOR IN VITRO. DIAGNOSTIC USE IN MONITORING THE PERFORMANCE OF THE ANTI-HBS2 ASSAY ON THE ADVIACENTAUR SYSTEMS. THE PERFORMANCE OF THE ANTI-HBS2 QUALITY CONTROL MATERIAL HAS NOT BEEN ESTABLISHED WITH ANY OTHER ANTI-HBS ASSAYS.","Test, Hepatitis B (B Core, Be Antigen, Be Antibody, B Core Igm)",Unknown,,3
P030008,S017,"Alcon Laboratories, Inc.",6201 South Freeway,,Fort Worth,TX,76134,2099,Excimer laser system,ALLEGRETTO WAVE EYE-Q EXCIMER LASER SYSTEM,LZS,OP,Ophthalmic,Normal 180 Day Track,Change Design/Components/Specifications/Material,N,2015-02-02,2015-05-01,,,APPR,"APPROVAL TO EXPAND THE APPROVAL OF THE TOPOLYZER VARIO TO INCLUDE ITS USE AS A DIAGNOSTIC DEVICE SUPPORTING THE WAVELIGHT EXCIMER LASERS IN PERFORMING T-CAT LASIK. THE DEVICE, AS MODIFIED, WILL BE MARKETED UNDER THE TRADE NAME ALLEGRO TOPOLYZER VARIO AND IS INDICATED FOR THE WAVELIGHT ALLEGRETTO WAVE® EYE-Q EXCIMER LASER SYSTEM USED IN CONJUNCTION WITH THE WAVELIGHT ALLEGRO TOPOLYZER (TOPOGRAPHER) OR ALLEGRO TOPOLYZER VARIO (TOPOGRAPHER) AND T-CAT TREATMENT PLANNING SOFTWARE IS INDICATED FOR PERFORMING TOPOGRAPHY-GUIDED LASER ASSISTED IN SITU KERATOMILEUSIS (TOPO-GUIDED (T-CAT) LASIK):1) FOR THE REDUCTION OR ELIMINATION OF UP TO -9.00 DIOPTERS (D) OF SPHERICAL EQUIVALENT MYOPIA OR MYOPIA WITH ASTIGMATISM, WITH UP TO -8.00 D OF SPHERICAL COMPONENT AND UP TO -3.00 D OF ASTIGMATIC COMPONENT AT THE SPECTACLE PLANE;2) IN PATIENTS WHO ARE 18 YEARS OF AGE OR OLDER; AND3) IN PATIENTS WITH DOCUMENTATION OF A STABLE MANIFEST REFRACTION DEFINED AS 0.50 D OR LESS OF PREOPERATIVE SPHERICAL EQUIVALENT SHIFT OVER ONE YEAR PRIOR TO SURGERY.",Excimer Laser System,Unknown,,3
P950021,S011,SIEMENS HEALTHCARE DIAGNOSTICS,333 CONEY STREET,,WALPOLE,MA,02032,1516,"Total, prostate specific antigen (noncomplexed & complexed) for detection of prostate cancer",ADVIA CENTAUR XP PSA ASSAY ON THE ADVIA CENTAUR XP (WITH VERSION 5.0 SOFTWARE),MTF,IM,Immunology,Normal 180 Day Track No User Fee,Labeling Change - Indications/instructions/shelf life/tradename,N,2009-04-10,2009-06-10,,,APPR,"APPROVAL FOR THE ADDITION OF THE ADVIA CENTAUR XP INSTRUMENT (WITH VERSION 5.0SOFTWARE) TO THE INSTRUMENT(S) USING THE ADVIA CENTAUR PSA ASSAY. THE DEVICE, AS MODIFIED, WILL BE MARKETED UNDER THE TRADE NAME ADVIA CENTAUR AND ADVIA CENTAUR XP PSA ASSAY AND ISINDICATED FOR THE MEASUREMENT OF SERUM PSA IN CONJUNCTION WITH DIGITAL RECTAL EXAM (DRE) AS AN AID IN THE DETECTION OF PROSTATE CANCER IN MEN AGED 50 YEARS AND OLDER. PROSTATE BIOPSY IS REQUIRED FOR THE DIAGNOSIS OF PROSTATE CANCER. THIS ASSAY IS FURTHER INDICATED AS AN AID IN THE MANAGEMENT (MONITORING) OF PATIENTS WITH PROSTATE CANCER.","Total, Prostate Specific Antigen (Noncomplexed & Complexed) For Detection Of Prostate Cancer",Unknown,,3
P130007,S016,ANIMAS CORP.,965 CHESTERBROOK BLVD.,,WAYNE,PA,19087,,"Pump, infusion, insulin, to be used with invasive glucose sensor",OneTouch Vibe Plus System,OYC,CH,Clinical Chemistry,Panel Track,Change Design/Components/Specifications/Material,N,2016-06-06,2016-12-16,16M-4458,2016-12-20,APPR,"Approval for the OneTouch Vibe Plus System is indicated for continuous subcutaneous insulin infusion for the management of insulin-requiring diabetes. It can be used solely for continuous insulin delivery and as part of the OneTouch Vibe Plus System to receive and display continuous glucose measurements from the Dexcom G5® Sensor and Transmitter. The OneTouch Vibe Plus System's continuous glucose monitoring (CGM) is indicated for detecting trends and tracking patterns in persons (ages 2 and older) with diabetes, and is intended to complement, not replace, information obtained from standard home glucose monitoring devices. CGM aids in the detection of episodes of hyperglycemia and hypoglycemia, facilitating both acute and long-term therapy adjustments, which may minimize these excursions. Interpretation of results from the Dexcom G5® Sensor and Transmitter should be based on the trends and patterns seen with several sequential readings over time. The System is intended for single patient use and requires a prescription.The Animas® Vibe® Systems continuous glucose monitoring (CGM) is indicated for detecting trends and tracking patterns in persons (age 2 and older) with diabetes, and is intended to complement, not replace, information obtained from standard home glucose monitoring devices. CGM aids in the detection of episodes of hyperglycemia and hypoglycemia, facilitating both acute and long-term therapy adjustments, which may minimize these excursions. Interpretation of results from the Dexcom G5® Sensor and Transmitter should be based on the trends and patterns seen with several sequential readings over time.The System is intended for single patient use and requires a prescription.","Pump, Infusion, Insulin, To Be Used With Invasive Glucose Sensor",Unknown,,3
P150005,S005,Boston Scientific Corp.,150 BAYTECH DRIVE,,SAN JOSE,CA,95134,,"catheter, percutaneous, cardiac ablation, for treatment of atrial flutter",INTELLANAV OPEN-IRRIGATED ABLATION CATHETER,OAD,CV,Cardiovascular,Normal 180 Day Track,Change Design/Components/Specifications/Material,N,2016-04-11,2016-07-07,,,APPR,"Approval for design changes to incorporate a magnetic sensor into the Blazer Open Irrigated Ablation Catheter. The device, as modified, will be marketed under the trade name IntellaNav Open-Irrigated Ablation Catheter and is indicated for:  The IntellaNav Open-Irrigated Catheter, when used with a Maestro 4000® Radiofrequency (RF) Controller and MetriQ Irrigation Pump, is indicated for:1) cardiac electrophysiological mapping; 2) delivering diagnostic pacing stimuli; and 3) RF ablation of sustained or recurrent type 1 atrial flutter in patients age 18 years or older.","Catheter, Percutaneous, Cardiac Ablation, For Treatment Of Atrial Flutter",Unknown,,3
P990014,S004,"Bausch & Lomb, Inc.",50 Technology Drive,,Irvine,CA,92618,,intraocular lens,HYDROVIEW COMPOSITE HYGROGEL FOLDABLE ULTRAVIOLET-ABSORBING POSTERIOR CHAMBER INTRAOCULAR (IOL),HQL,OP,Ophthalmic,Real-Time Process,Labeling Change - Indications/instructions/shelf life/tradename,N,2003-08-25,2003-09-16,,,APPR,"APPROVAL FOR A NEW TRADE NAME FOR THE HP60M HYDROGEL IOL.  THE DEVICE, AS MODIFIED, WILL BE MARKETED UNDER THE TRADE NAME ""MERIDIAN"" AND IS INDICATED FOR PRIMARY IMPLANTATION FOR THE VISUAL CORRECTION OF APHAKIA IN PATIENTS 60 YEARS OF AGE OR OLDER WHERE A CATARACTOUS LENS HAS BEEN REMOVED BY EXTRACAPSULAR EXTRACTION METHODS.  THE LENS IS DESIGNED FOR IMPLANTATION IN THE CAPSULAR BAG FOLLOWING EXTRACAPSULAR CATARACT EXTRACTION.",Intraocular Lens,Ophthalmic,886.3600,3
P130017,S029,Exact Sciences Corporation,441 Charmany Drive,,Madison,WI,53719,,"System, colorectal neoplasia, DNA methylation and hemoglobin detection",Cologuard Stool DNA-Based Colorectal Cancer Screening Test,PHP,PA,Pathology,Normal 180 Day Track,Labeling Change - Indications/instructions/shelf life/tradename,N,2019-04-12,2019-09-20,,,APPR,Approval to expand the indicated age range for Cologuard Stool DNA-Based Colorectal Cancer Screening Test from 50 years or older to 45 years or older.,"System, Colorectal Neoplasia, Dna Methylation And Hemoglobin Detection",Unknown,,3
P990025,S009,"BIOSENSE WEBSTER, INC.",31 Technology Drive,Suite 200,Irvine,CA,92618,,Cardiac ablation percutaneous catheter,NAVISTAR RMT DIAGNOSTIC/ABLATION STEERABLE TIP CATHETER,LPB,CV,Cardiovascular,Normal 180 Day Track,Change Design/Components/Specifications/Material,N,2005-04-27,2006-01-26,,,APPR,"APPROVAL FOR ADDING REMOTE MAGNETIC NAVIGATION TECHNOLOGY TO THE PREVIOUSLY APPROVED CATHETER.  THE DEVICE, AS MODIFIED, WILL BE MARKETED UNDER THE TRADE NAME NAVISTAR RMT DIAGNOSTIC/ABLATION STEERABLE TIP CATHETER AND IS INDICATED FOR CATHETER-BASED ATRIAL AND VENTRICULAR ELECTROPHYSIOLOGIC MAPPING AND FOR USE WITH THE STEREOTAXIS MAGNETIC NAVIGATION SYSTEM (MNS) AND COMPATIBLE RADIOFREQUENCY GENERATORS IN ADULTS AND CHILDREN FOUR (4) YEARS OF AGE OR OLDER IN CREATING ENDOCARDIAL LESIONS DURING CARDIAC ABLATION PROCEDURES TO TREAT ARRHYTHMIAS.  WHEN USED WITH THE CARGO? EP NAVIGATION SYSTEM, THE NAVISTAR RMT CATHETER PROVIDES LOCATION INFORMATION.",Cardiac Ablation Percutaneous Catheter,Unknown,,3
P970043,S015,ALCON LABORATORIES,6201 S FREEWAY,,FT WORTH,TX,76134,,Excimer laser system,LADARVISION 4000 EXCIMER LASER SYSTEM,LZS,OP,Ophthalmic,Panel Track,Labeling Change - Indications/instructions/shelf life/tradename,N,2003-09-30,2004-06-29,04M-0312,2004-07-16,APPR,"APPROVAL FOR THE LADARVISION 4000 EXCIMER LASER SYSTEM.  THE DEVICE USES A 6.5 MM OPTICAL ZONE, A 9.00 MM ABLATION ZONE, IS LOCKED-OUT FOR TREATMENTS ABOVE -9.75 DIOPTERS (D) SPHERE, -5.00D CYLINDER, AND -10.63D SPHERICAL EQUIVALENT (SE), AND IS INDICATED FOR WAVEFRONT-GUIDED LASER ASSISTED IN-SITU KERATOMILEUSIS (LASIK):  1) FOR THE REDUCTION OR ELIMINATION OF MYOPIC ASTIGMATISM UP TO -8.00D SPHERE WITH -0.50 TO -4.00D CYLINDER AND UP TO -8.00D SE AT THE SPECTACLE PLANE; 2) IN PATIENTS WHO ARE 21 YEARS OF AGE OR OLDER; AND 3) IN PATIENTS WITH DOCUMENTED STABILITY OF REFRACTION FOR THE PRIOR 12 MONTHS, AS DEMONSTRATED BY A CHANGE IN SPHERE AND CYLINDER OF LESS THAN OR EQUAL TO 0.50D FOR A SE OF UP TO -6.00D AND LESS THAN OR EQUAL TO 0.75D FOR A SE GREATER THAN -6.00D.",Excimer Laser System,Unknown,,3
P160015,,ZOLL MEDICAL CORPORATION,269 & 271 MILL ROAD,,Chelmsford,MA,01824,,Automated external defibrillators (non-wearable),AED Plus and Fully Automatic AED Plus,MKJ,CV,Cardiovascular,,,N,2016-06-02,2017-05-26,17M-3372,2017-08-07,APPR,"Approval for the AED Plus and Fully Automatic AED Plus.  These devices are indicated for use when a suspected cardiac arrest victim has an apparent lack of circulation as indicated by:1)	Unconsciousness;2)	Absence of normal breathing; and3)	Absence of a pulse or signs of circulationThese devices are intended for use by personnel who have been trained in their operation. Users should have received training in basic life support/AED, advanced life support or a physician-authorized emergency medical response training program.When a victim is less than 8 years of age, or weighs less than 55 lbs. (25kg), the ZOLL AED Plus® and Fully Automatic AED Plus® should be used with the ZOLL AED Plus and Fully Automatic AED Plus® Pediatric Electrodes. Therapy should not be delayed to determine the patients exact age or weight.",Automated External Defibrillators (Non-Wearable),Cardiovascular,870.5310,3
P980022,S015,MEDTRONIC MINIMED,18000 DEVONSHIRE ST,,NORTHRIDGE,CA,91325,,"Sensor, glucose, invasive",GUARDIAN REAL-TIME AND PARADIGM REAL-TIME SYSTEMS,MDS,CH,Clinical Chemistry,Panel Track,Labeling Change - Indications/instructions/shelf life/tradename,Y,2006-02-27,2007-03-08,07M-0107,2007-03-26,APPR,"APPROVAL FOR THE PARADIGM REAL-TIME AND GUARDIAN REAL-TIME SYSTEMS.  THE GUARDIAN REAL-TIME SYSTEM IS INDICATED FOR CONTINUOUS OR PERIODIC MONITORING OF GLUCOSE LEVELS IN THE FLUID UNDER THE SKIN, IN ADULTS, AGE 18 AND OVER, AND IN CHILDREN AND ADOLESCENTS, AGE 7 TO 17, WITH DIABETES MELLITUS, FOR THE PURPOSE OF IMPROVING DIABETES MANAGEMENT.  IT ALERTS IF A GLUCOSE LEVEL FALLS BELOW, OR RISES ABOVE, PRESET VALUES.  VALUES ARE NOT INTENDED TO BE USED DIRECTLY FOR MAKING THERAPY ADJUSTMENTS, BUT RATHER TO PROVIDE AN INDICATION OF WHEN A FINGERSTICK MAY BE REQUIRED. ALL THERAPY ADJUSTMENTS SHOULD BE BASED ON MEASUREMENTS OBTAINED USING A HOME GLUCOSE MONITOR.  THE SYSTEM PROVIDES REAL-TIME GLUCOSE VALUES THAT ALLOW USERS TO TRACK PATTERNS IN GLUCOSE CONCENTRATIONS AND TO POSSIBLY IDENTIFY EPISODES OF LOW AND HIGH BLOOD GLUCOSE.  IT ALSO STORES THE DATA SO THAT IT CAN BE ANALYZED TO TRACK PATTERNS.  GLUCOSE DATA CAN BE FURTHER DOWNLOADED TO PC SOFTWARE FOR ANALYSIS OF HISTORICAL GLUCOSE VALUES.  THE PARADIGM REAL-TIME SYSTEM IS INDICATED FOR CONTINUOUS OR PERIODIC MONITORING OF GLUCOSE LEVELS IN THE FLUID UNDER THE SKIN, AND POSSIBLE LOW AND HIGH BLOOD GLUCOSE EPISODES IN ADULTS, AGE 18 AND OVER, AND IN CHILDREN AND ADOLESCENTS, AGE 7 THROUGH 17.  THE SYSTEM PROVIDES AN ALERT IF GLUCOSE LEVELS FALL BELOW OR RISE ABOVE PRESET VALUES.  GLUCOSE VALUES PROVIDED BY THE SYSTEM ARE NOT INTENDED TO BE USED DIRECTLY FOR MAKING THERAPY ADJUSTMENTS, BUT RATHER TO PROVIDE AN INDICATION OF WHEN A FINGERSTICK MAY BE REQUIRED.  ALL THERAPY ADJUSTMENTS SHOULD BE BASED ON MEASUREMENTS OBTAINED USING A HOME GLUCOSE MONITOR AND NOT ON SENSOR GLUCOSE READINGS PROVIDED BY THE PARADIGM REAL-TIME SYSTEM.","Sensor, Glucose, Invasive",Unknown,,3
P030008,S003,"Alcon Laboratories, Inc.",6201 South Freeway,,Fort Worth,TX,76134,2099,Excimer laser system,ALLEGRETTO WAVE EYE-Q EXCIMER LASER SYSTEM,LZS,OP,Ophthalmic,Normal 180 Day Track,Change Design/Components/Specifications/Material,N,2005-04-01,2006-06-16,,,APPR,"APPROVAL FOR A CHANGE IN REPETITION RATE FROM 200 HZ TO 400 HZ.  THE DEVICE, AS MODIFIED, WILL BE MARKETED UNDER THE TRADE NAME ALLEGRETTO WAVE EYE-Q EXCIMER LASER SYSTEM AND IS INDICATED FOR LASER ASSISTED IN SITU KERATOMILEUSIS (LASIK) IN PATIENTS WHO ARE 18 YEARS OF AGE OR OLDER:  1) FOR THE REDUCTION OR ELIMINATION OF MYOPIA OF UP TO -12.0 DIOPTERS (D) OF SPHERE AND UP TO -6.0 D OF ASTIGMATISM AT THE SPECTACLE PLANE IN PATIENTS WITH DOCUMENTATION OF A STABLE MANIFEST REFRACTION DEFINED AS <=0.50 D OF PREOPERATIVE SPHERICAL EQUIVALENT SHIFT OVER ONE YEAR PRIOR TO SURGERY; AND 2) FOR THE REDUCTION OR ELIMINATION OF HYPEROPIC REFRACTIVE ERRORS UP TO +6.0 D OF SPHERE WITH AND WITHOUT ASTIGMATIC REFRACTIVE ERRORS UP TO 5.0 D AT THE SPECTACLE PLANE, WITH A MAXIMUM MANIFEST REFRACTION SPHERICAL EQUIVALENT (MRSE) OF +6.0 D IN PATIENTS WITH DOCUMENTATION OF A STABLE MANIFEST REFRACTION DEFINED AS <=0.50 D OF PREOPERATIVE SPHERICAL EQUIVALENT SHIFT OVER ONE YEAR PRIOR TO SURGERY, EXCLUSIVE OF CHANGES DUE TO UNMASKING LATENT HYPEROPIA.",Excimer Laser System,Unknown,,3
